intent,scenario,conversation_text,sentiment,user_speech_type
CREDIT_SCORE_QUERY,"The bank has contacted a customer about a past-due student loan balance that is now 60 days overdue. The customer, a graduate student struggling to make ends meet due to a part-time job with limited hours, is worried about how this delinquency will impact their credit score and whether it could jeopardize their ability to qualify for future student loans. They are seeking clarity on whether this overdue balance has already been reported to the credit bureaus and what potential effects it could have on their credit score.","

Bot: Hi there, this is an important message from our bank regarding your account. We wanted to reach out to you about your past-due student loan balance. Can you please confirm that you received this message?

User: yeah, I got it. I'm just trying to figure out how this is gonna affect my credit score. Have you guys already reported the overdue balance to the credit bureaus?

Bot: I understand your concern, and I'd be happy to help clarify things for you. We typically report delinquencies to the credit bureaus after a 90-day period, but in your case, we're reaching out to you proactively to discuss options for getting back on track. We want to ensure you understand the potential impact on your credit score.

User: Okay, so 90 days is the usual timeframe? That's 30 days from now, right? I just need to make sure I get this sorted out before then.

Bot: That's correct. The 90-day period is our standard process for reporting delinquencies. However, I want to emphasize that we're not looking to negatively impact your credit score. We're working with you to find a solution that works for everyone involved.

User: Alright, that makes sense. So what kind of impact could this have on my credit score if it's reported? I'm worried it might make it harder for me to get a new student loan in the future.

Bot: Reporting a delinquency can potentially lower your credit score, but it's also an opportunity for you to demonstrate responsible financial habits by making timely payments moving forward. We can work together to create a plan to get your account current, which will help minimize the impact on your credit score.

User: That's a relief to hear. What's the best way to get my account up to date, and what kind of assistance can I expect from the bank?

Bot: We have a few options available to help you get back on track. I can explain them in more detail and provide information on any assistance programs we may offer. Would you like me to outline those options for you?",neutral,casual
CREDIT_SCORE_QUERY,"The bank has contacted a customer about a past-due student loan balance that is now 60 days overdue. The customer, a graduate student struggling to make ends meet due to a part-time job with limited hours, is worried about how this delinquency will impact their credit score and whether it could jeopardize their ability to qualify for future student loans. They are seeking clarity on whether this overdue balance has already been reported to the credit bureaus and what potential effects it could have on their credit score.","

Bot: Hi there, this is [Bank Name] calling about your account. I wanted to reach out to you regarding a past-due balance on your student loan. Can you tell me a little bit about what's going on and when you might be able to make a payment?

User: oh no, i'm so confused... i thought i had set up a payment plan or something. i've been trying to get more hours at my part-time job but it's been tough. can you tell me if this overdue balance has already been reported to the credit bureaus? i'm worried about my credit score.

Bot: I understand your concern, and I'm happy to help clarify things for you. As for the payment plan, I can look into that for you. However, regarding the credit bureaus, our policy is to report past-due accounts to the credit bureaus after 90 days of non-payment. Since your account is currently 60 days overdue, it hasn't been reported yet, but it will be if we don't hear from you soon.

User: okay, that helps a bit, i guess. but what happens if it does get reported? will it hurt my credit score a lot? i'm worried about qualifying for future student loans if this delinquency gets on my record.

Bot: I completely understand your concern about the impact on your credit score. While a delinquency can certainly affect your credit score, it's not necessarily a guarantee that it will significantly hurt your credit. However, it's always best to try to avoid late payments and make arrangements to pay your balance as soon as possible. If you'd like, I can also provide you with some information on how to dispute the delinquency or set up a payment plan to avoid further damage to your credit.

User: yeah, that would be great. i just want to make sure i understand what's going on and how to fix it. thanks for being so helpful!",confused,casual
PAY_NOW,"A customer recently experienced a sudden job loss and was unable to make their credit card payment, resulting in a past-due balance of $2,356.90. After securing temporary freelance work and receiving their first payment, they immediately contacted collections to settle the full overdue amount using their linked savings account 9012.","

Bot: Hello, this is [Bank Name] collections. How can I assist you today?

User: Oh hi, um, I think I need to talk about my account. I just got paid from my freelance work and I wanna pay off the debt I owe. I was trying to figure out how to do that.

Bot: Congratulations on your new freelance work! We appreciate your commitment to paying off your debt. Can you please confirm your account name so I can locate your account information?

User: I'm not really sure what my account name is. I just know it's a credit card account. Is there any way you can look it up?

Bot: I can look up your account information for you. Can you please provide your social security number or the last four digits of your account number so I can verify your identity?

User: Um, I don't know my account number either. I was hoping to use my savings account to pay it off, though. I have the account number for that one, though. It's 9012. Can I pay with that?

Bot: I apologize for the confusion. I can help you set up a payment using your savings account. Can you please confirm the routing and account number for your savings account?

User: Yeah, the routing number is... um... *pause*... let me check on my phone. *pause* Okay, it's the same as my credit card account. Can you just transfer the money from my savings to my credit card account?

Bot: I can help you set up a payment using your savings account. However, to ensure that the payment is processed correctly, I'll need the account number and routing number for your savings account. Can you please provide that information again?",confused,casual
PAY_NOW,"A customer recently experienced a sudden job loss and was unable to make their credit card payment, resulting in a past-due balance of $2,356.90. After securing temporary freelance work and receiving their first payment, they immediately contacted collections to settle the full overdue amount using their linked savings account 9012.","

Bot: Hi there, this is [Bank Name] Collections. How can we help you today?

User: Hey, thanks for reaching out. I think I might have a payment due on my credit card. Can you check?

Bot: I'd be happy to help. Can you please confirm your account information with me so I can look into this further?",neutral,casual
PAY_NOW,"A customer recently experienced a sudden job loss and was unable to make their credit card payment, resulting in a past-due balance of $2,356.90. After securing temporary freelance work and receiving their first payment, they immediately contacted collections to settle the full overdue amount using their linked savings account 9012.","

Bot: Hi there, thank you for reaching out to us about your past-due balance. I'd be happy to help you get your account up to date. Can you please confirm your account details so I can assist you further?

User: omg i think my account is like 2356.90 past due and i just got a new job but i wanna pay it all off now cuz i feel bad about it, can i do that?

Bot: I understand that you're eager to settle your balance. To confirm, you're looking to pay the total amount of $2,356.90. Can you tell me what payment method you'd like to use to make this payment?

User: yeah i wanna use my savings account 9012 that i have linked with u guys

Bot: Great, I can process a payment from your linked savings account. However, to ensure the transaction is processed correctly, I just need to confirm that you're aware of the total amount being paid, which is $2,356.90. Are you okay with this?

User: yea thats fine but how long will it take for the payment to reflect on my credit card?

Bot: The payment will be processed immediately, and the update will reflect on your account within 1-2 business days. You'll receive a confirmation email once the payment has been successfully applied to your credit card.",confused,casual
PAY_NOW,"A customer recently experienced a sudden job loss and was unable to make their credit card payment, resulting in a past-due balance of $2,356.90. After securing temporary freelance work and receiving their first payment, they immediately contacted collections to settle the full overdue amount using their linked savings account 9012.","

Bot: Hi there, thank you for reaching out to us about your past-due balance. I'm here to help you settle this issue as quickly as possible. Can you please confirm your account information so I can look into this further?

User: Yeah, I'm good. I just got a new freelance gig and I'm ready to pay off the debt. I'd like to use my savings account to cover the $2,356.90 balance.

Bot: I'm glad to hear that you're getting back on your feet. I'd be happy to assist you in paying off your balance. To confirm, you'd like to use your savings account to pay the full balance of $2,356.90, correct?

User: Exactly, that's what I want to do.

Bot: Great, I'm going to go ahead and process the payment. Can you please confirm that you have the available funds in your savings account to cover this amount?

User: Yeah, I've already checked. The funds are available and I'm ready to proceed.

Bot: Wonderful, I've initiated the payment process. You should see the funds being deducted from your savings account shortly. If everything goes smoothly, your account should be updated to reflect the payment within the next few hours.

User: That sounds good, I appreciate your help in getting this settled.

Bot: You're welcome, and I'm happy to help. If you have any questions or concerns in the future, please don't hesitate to reach out.",neutral,casual
PAY_NOW,"A customer recently experienced a sudden job loss and was unable to make their credit card payment, resulting in a past-due balance of $2,356.90. After securing temporary freelance work and receiving their first payment, they immediately contacted collections to settle the full overdue amount using their linked savings account 9012.","

Bot: Hi there, this is [Bank Name] Collections. How can I assist you today?

User: Hey, I'm calling about a past-due balance on my account. I just got some freelance work and I'd like to pay off the full amount.

Bot: Congratulations on the new opportunity, and thank you for reaching out to settle your account. Can you please confirm your account name so I can look up the details?

User: Yeah, my name is on the account. I'd just like to pay the $2,356.90 that's past due.

Bot: I've located your account. To confirm, you'd like to pay the full balance of $2,356.90 using your linked savings account 9012, correct?

User: That's right. I want to settle this as soon as possible.

Bot: I appreciate your promptness. Before we proceed with the payment, I just need to confirm a few details. Are you authorized to make a payment of this amount from your linked savings account 9012?

User: Yeah, I'm authorized. I'd like to do this today, please.

Bot: Great, I'm glad we could work together to get this settled. I'm going to go ahead and process the payment from your savings account 9012. You'll see the funds deducted within the next few minutes. Is there anything else I can assist you with today?",neutral,casual
REQUEST_PAYMENT_PLAN,"The bank has contacted a customer about a past-due credit card balance that accumulated after they were involved in a car accident, resulting in increased insurance premiums and out-of-pocket expenses. Although they’ve returned to work and are earning a steady income, the unexpected expenses have left them with a significant financial burden. To avoid further penalties and protect their credit, they request a payment plan to repay the past-due balance in six biweekly installments using their checking account, which they believe can support the smaller, predictable payments.","

Bot: Hello, this is [Bank Name] calling about your credit card account. How are you today?

User: I'm doing alright, thanks for asking. I just got your message about the past-due balance. I'm a little concerned about it.

Bot: I completely understand. We're here to help. It looks like your balance became past due due to some unexpected expenses. Can you tell me a bit more about what's been going on? We want to make sure you're aware of all the options available to you.

User: Yeah, I was in a car accident a few months ago and it ended up costing me a lot more than I anticipated. My insurance premiums went up and I had some out-of-pocket expenses. I've been trying to catch up ever since I got back to work.

Bot: I'm so sorry to hear that. It can be really tough to deal with unexpected expenses like that. We want to make sure you're not facing any additional penalties or damage to your credit. Would you be interested in setting up a payment plan to pay off the past-due balance in installments?

User: Yeah, that would be great. I think I can afford to make smaller payments every two weeks. Can I set up payments from my checking account?

Bot: Absolutely. We can definitely set up a payment plan for you. I'll just need to confirm a few details. Would you prefer to make six biweekly payments, like you mentioned? And would you like to have the payments automatically drafted from your checking account on the same day each month?

User: That sounds perfect. Yeah, six biweekly payments would work great. And yeah, I'd like to set it up to draft from my checking account.",neutral,casual
REQUEST_PAYMENT_PLAN,"The bank has contacted a customer about a past-due credit card balance that accumulated after they were involved in a car accident, resulting in increased insurance premiums and out-of-pocket expenses. Although they’ve returned to work and are earning a steady income, the unexpected expenses have left them with a significant financial burden. To avoid further penalties and protect their credit, they request a payment plan to repay the past-due balance in six biweekly installments using their checking account, which they believe can support the smaller, predictable payments.","

Bot: Hi there, this is [Bank Name] calling about your account. We wanted to reach out regarding your past-due balance on your credit card. How are you doing today?

User: Hey, I'm doin alright, just tryin to get back on my feet after that car accident. Got hit with some pretty unexpected expenses.

Bot: Sorry to hear that. We're here to help. Can you tell me a bit more about what's been going on? How have the increased insurance premiums and out-of-pocket expenses affected your finances?

User: Yeah, it's been tough. I had to dip into my savings to cover some of the costs, but now I'm gettin' back to work and makin' a steady income again. I just need a little help gettin' back on track with this past-due balance.

Bot: I understand that things can be challenging, especially when unexpected expenses come up. What we'd like to offer is a payment plan that would allow you to repay the past-due balance in smaller, more manageable installments. Would you be interested in that?

User: Yeah, that sounds like exactly what I need. Can we set it up to take biweekly payments from my checking account?

Bot: Absolutely, we can definitely do that. Let me just go ahead and get the details sorted out for you. Can you confirm that your checking account information is up to date with us?

User: Yeah, my account info should be good to go. Just make sure it's set up to take the biweekly payments, and I'll be all good.",neutral,slang
REQUEST_PAYMENT_PLAN,"The bank has contacted a customer about a past-due credit card balance that accumulated after they were involved in a car accident, resulting in increased insurance premiums and out-of-pocket expenses. Although they’ve returned to work and are earning a steady income, the unexpected expenses have left them with a significant financial burden. To avoid further penalties and protect their credit, they request a payment plan to repay the past-due balance in six biweekly installments using their checking account, which they believe can support the smaller, predictable payments.","

Bot: Hi there, this is [Bank Name] reaching out about your account. We wanted to touch base with you about your current balance. You've had some unexpected expenses recently and we're here to help.

User: Yeah, I've been dealing with a lot of stuff after my car accident. Insurance premiums went up and I had to pay out of pocket for some repairs. I've since gotten back to work, but it's been tough.

Bot: We understand that accidents can be costly and unpredictable. We're here to support you. Can you tell me a little bit about your current financial situation? Are you still working on getting back on your feet?

User: Yeah, I'm working a steady job now and my income is pretty stable. I just need a little bit of time to get caught up on my expenses. I've been trying to make payments whenever I can, but it's been tough.

Bot: That makes sense. We want to work with you to find a solution that fits your needs. Can you tell me a little bit about what you're looking to do with your payments? Are you interested in setting up a payment plan to help you get back on track?

User: Yeah, that would be great. I was thinking maybe six biweekly payments would be doable for me. And I'd like to use my checking account to make those payments, if that's possible.

Bot: That sounds like a good plan. I can definitely help you set that up. Let me just check a few things with our system. (pause) Okay, it looks like we can set up a payment plan for you with six biweekly payments using your checking account. Would you like to go ahead and confirm the details with me?",neutral,casual
REQUEST_PAYMENT_PLAN,"The bank has contacted a customer about a past-due credit card balance that accumulated after they were involved in a car accident, resulting in increased insurance premiums and out-of-pocket expenses. Although they’ve returned to work and are earning a steady income, the unexpected expenses have left them with a significant financial burden. To avoid further penalties and protect their credit, they request a payment plan to repay the past-due balance in six biweekly installments using their checking account, which they believe can support the smaller, predictable payments.","

Bot: Hello, this is [Bank Name] calling about your credit card account. We wanted to discuss the past-due balance that's currently overdue.

User: What are you talking about? I've been paying my bills on time, and I don't recall any issues. What's this about?

Bot: I apologize if there's been a miscommunication. Our records show that there's a balance of $2,500 that's past due. We're reaching out to discuss possible options for bringing the account up to date.

User: I don't understand how this happened. I've been working hard to get back on my feet after the accident last year. Those insurance premiums and medical bills piled up quickly. Now I'm stuck with a huge debt. I've started earning a steady income again, but it's still tough to keep up.

Bot: I understand that unexpected expenses can be challenging to manage. We're here to help you find a solution that works for you. Can you tell me a little bit about your current financial situation? What's your monthly income, and what are your monthly expenses?

User: My income is around $5,000 per month, and my expenses include a mortgage, car payment, groceries, and insurance. I've been trying to prioritize my spending, but it's tough to make ends meet. That's why I'd like to set up a payment plan to pay off the past-due balance in six biweekly installments using my checking account.

Bot: I'd be happy to help you explore that option. To confirm, you'd like to make six biweekly payments from your checking account to pay off the past-due balance. Can you tell me what the total amount of the payments would be, and how much you'd like to pay per biweekly installment?

User: If I break it down, the total amount is $2,500, and if I make six biweekly payments, each payment would be around $416. I'm confident that my checking account can handle those payments. I'd greatly appreciate it if we could set this up as soon as possible to avoid any further penalties.

Bot: I've taken note of your request. I'll go ahead and process the payment plan for you. You should receive an email with the details of the plan, including the payment schedule and amount. If you have any questions or need further assistance, please don't hesitate to reach out to us.",angry,professional
REQUEST_PAYMENT_PLAN,"The bank has contacted a customer about a past-due credit card balance that accumulated after they were involved in a car accident, resulting in increased insurance premiums and out-of-pocket expenses. Although they’ve returned to work and are earning a steady income, the unexpected expenses have left them with a significant financial burden. To avoid further penalties and protect their credit, they request a payment plan to repay the past-due balance in six biweekly installments using their checking account, which they believe can support the smaller, predictable payments.","

Bot: Hi there, this is an automated call from Bank of America. We're reaching out to discuss your credit card account. You have a past-due balance that we'd like to help you resolve.

User: Yeah, I'm aware of that. I've been meaning to get back to you about it. To be honest, things have been a bit tough since the car accident last month.

Bot: I'm so sorry to hear that. We understand that unexpected expenses can be challenging to manage. Can you tell me a bit more about your current situation and how you think you'll be able to pay off the balance?

User: Well, I'm back at work now and my income is steady, but those insurance premiums and out-of-pocket expenses really hit me hard. I'm trying to get back on track, but I was wondering if there's any way I could set up a payment plan to make things more manageable.

Bot: That's completely understandable. We're happy to work with you to find a solution. A payment plan can definitely help spread out the payments and make it more affordable for you. Would you like to set up a six-biweekly payment plan using your checking account?

User: Yeah, that sounds perfect. I think my account can handle those smaller payments, and it'll be easier for me to keep track of everything. Can you walk me through the process and let me know what the total payments will be?

Bot: Absolutely. I'd be happy to guide you through it. Based on the current balance, your six biweekly payments would be [insert amount]. We'll also send you a confirmation email with the payment details and schedule. Is there anything else you'd like to discuss or any questions you have before we move forward?",neutral,casual
