intent,scenario,conversation_text,sentiment,user_speech_type
PAY_NOW,"A customer received a collections notice for their overdue mortgage balance after missing payments due to a prolonged period of unemployment. After securing a new full-time job with a stable income, they are now able to pay the full past-due balance of $8,120.52 immediately using their linked checking account 1234.","

Bot: Hi there, we wanted to reach out to you regarding your recent mortgage payment. Can you please confirm that you received the notice we sent about the past-due balance?

User: i recieved the notice dont worry about it i just got a new job and will be able to pay the whole thing off right away

Bot: That's great news, congratulations on your new job! We're happy to hear that you'll be able to settle the past-due balance. Can you confirm that you'd like to pay the full amount of $8,120.52 immediately?

User: yeah thats all of it im sending it now from my checking account #1234

Bot: We appreciate your prompt payment. To confirm, we'll use the funds from your checking account to settle the past-due balance. Is that correct?

User: yeah thats fine just make sure its done today thanks",neutral,typos
PAY_NOW,"A customer received a collections notice for their overdue mortgage balance after missing payments due to a prolonged period of unemployment. After securing a new full-time job with a stable income, they are now able to pay the full past-due balance of $8,120.52 immediately using their linked checking account 1234.","

Bot: Hello, this is a representative from Oakwood Bank. We're calling to discuss a past-due balance on your mortgage account. Can you please confirm your identity for security purposes?

User: Yes, I can confirm my identity. I'm the account holder and I'd like to discuss the collections notice I received recently.

Bot: Thank you, sir/madam. We appreciate your prompt attention to this matter. The past-due balance on your account is $8,120.52. Can you please tell me a little about your current financial situation and what led to the missed payments?

User: I was unfortunately unemployed for a while, but I've recently secured a new full-time job with a stable income. I'm now in a position to pay the full past-due balance immediately.

Bot: That's great news, sir/madam! We're happy to hear that you're back on your feet. To process the payment, I'll need you to link your checking account to our system. Can you please confirm that you have a checking account with us, and if so, provide the account number so we can facilitate the payment?

User: I do have a checking account with Oakwood Bank. The account number is 1234. I'd like to pay the past-due balance immediately using this account.",neutral,professional
PAY_NOW,"A customer received a collections notice for their overdue mortgage balance after missing payments due to a prolonged period of unemployment. After securing a new full-time job with a stable income, they are now able to pay the full past-due balance of $8,120.52 immediately using their linked checking account 1234.","

Bot: Hi there, this is a representative from Bank of America. We're reaching out because we noticed that your mortgage account is past due. Can you tell us a little bit about what's going on?

User: um, yeah... i think i might have missed a few payments. my unemployment thing was pretty long and i couldn't pay. but now i've got a new job and i'm all set. what's the total i owe?

Bot: Congratulations on your new job! I'm happy to help you with your account. The total past-due balance is $8,120.52. We'd like to work with you to get you back on track.

User: okay, cool. so how do i pay it? can i just transfer it from my checking account?

Bot: Yes, you can definitely pay the balance using your linked checking account. Please let me guide you through the process. Can you confirm that the account number associated with your checking account is 1234?

User: yeah, that's right. what do i do next?

Bot: Great! To initiate the payment, I'll need you to confirm the payment amount and the account you'd like to use. Please type 'yes' to confirm the payment of $8,120.52 using your checking account 1234.

User: yeah, that's all good. just pay it for me.",confused,casual
SPEAK_TO_AGENT,"The bank has contacted a customer regarding a past-due mortgage payment that is now 45 days overdue. The customer has been experiencing issues with the bank's automated phone system, which has resulted in them being disconnected multiple times. They are concerned about the potential consequences of not making payments and want to speak with a human agent to explain their situation, verify their payment history, and explore options for temporary forbearance or a hardship plan.","

Bot: Good morning, this is an representative from [Bank Name]. How can I assist you today?

User: Good morning. I appreciate you calling. I've been trying to reach someone about my mortgage, but the automated system keeps disconnecting me. I'm concerned about the status of my account.

Bot: I apologize for the inconvenience you've experienced with our automated system. I'd be happy to help you with your mortgage account. Can you please confirm your account information so I can access your file?

User: I'd rather not share that information over the phone. Is there a way we can discuss this in person or through email?

Bot: I understand your concern about sharing sensitive information. However, to ensure I'm speaking with the correct account holder, I'll need to verify some details. If you're not comfortable sharing your account information, I can offer to send you a secure email with a link to discuss your account in more detail.

User: I appreciate your understanding. Could you explain the current status of my account, specifically the past-due balance and any associated fees?

Bot: Based on my review of your account, it appears you have a past-due balance of $X, which is currently 45 days overdue. I want to assure you that our goal is to work with you to find a solution. Can you please tell me a little bit about what's been going on and why you're experiencing difficulty making payments?

User: I've been facing some unexpected financial challenges, and I'm trying to get everything back on track. I'd like to explore options for temporary forbearance or a hardship plan to avoid any further consequences.

Bot: I'm happy to help you explore those options. Can you please provide some information about your income, expenses, and any assets you may have? This will give me a better understanding of your situation and allow me to discuss possible solutions with you.

User: I'd be happy to provide that information. Can you also verify my payment history with the bank to ensure everything is accurate?

Bot: I'll make sure to review your payment history and provide you with an accurate summary. I'll also discuss the potential consequences of not making payments and the benefits of setting up a hardship plan or temporary forbearance. Is there anything specific you'd like to know or discuss regarding your account before we move forward?",neutral,professional
SPEAK_TO_AGENT,"The bank has contacted a customer regarding a past-due mortgage payment that is now 45 days overdue. The customer has been experiencing issues with the bank's automated phone system, which has resulted in them being disconnected multiple times. They are concerned about the potential consequences of not making payments and want to speak with a human agent to explain their situation, verify their payment history, and explore options for temporary forbearance or a hardship plan.","

Bot: Hello, this is a representative from [Bank Name]. How can we assist you today?

User: i was just tryin to pay my mortgage and the phone systm kept dropin me. i think i need to talk to some one

Bot: I apologize for the inconvenience you experienced with our automated phone system. I'd be happy to help you with your mortgage payment. Can you please confirm your name and account information so I can access your account?

User: i dont no my account info rite off the top of my hed. can we go ov that laer? i just wanna make shure i dont loose my hous

Bot: Of course, we can discuss your account information later. For now, let's focus on your mortgage payment. Can you tell me a little bit about what's going on with your payment? You mentioned it's been a challenge to reach us. Is everything okay?

User: yeah, everythin is ok... i just havent had the best month financly and im worried bout the past due amount. i was hopin we could talk about some kinda plan to get me caught up

Bot: I understand your concerns. You're right to want to get back on track. Can you tell me a bit more about what's going on with your finances? This will help me better understand your situation and see what options might be available to you.",neutral,typos
SPEAK_TO_AGENT,"The bank has contacted a customer regarding a past-due mortgage payment that is now 45 days overdue. The customer has been experiencing issues with the bank's automated phone system, which has resulted in them being disconnected multiple times. They are concerned about the potential consequences of not making payments and want to speak with a human agent to explain their situation, verify their payment history, and explore options for temporary forbearance or a hardship plan.","

Bot: Hello, this is an important message from [Bank Name]. We're calling about your mortgage account. Can you please confirm your identity so we can discuss your account with you?

User: Hi, yeah, I think I know what this is about. I've been getting a lot of automated messages about my past-due payment. I'm having some trouble getting through to a live person on the phone, though. I've gotten disconnected a few times.

Bot: I apologize for the inconvenience, and I'm happy to help you today. Can you please confirm your name and the last four digits of your Social Security number so I can access your account information securely?

User: My name is [Customer's Name], and my SSN ends in 1234. I'd just like to get this taken care of so I can avoid any further issues down the line.

Bot: Thank you for providing that information. I've accessed your account, and I see that your mortgage payment is indeed 45 days past due. I want to assure you that we're here to help. Can you tell me a little bit about what's been going on and why you're having trouble making your payments?

User: Honestly, I've just been dealing with some unexpected expenses and income fluctuations. I'm not sure what my financial situation is going to look like in the next few months, but I'm committed to making my payments. I just need some temporary relief to get back on track.

Bot: I understand, and I appreciate your commitment to your payments. Let me see what options we can discuss for temporary forbearance or a hardship plan that might be a good fit for you. Can you please confirm your employment status and income information so I can better understand your situation?

User: I'm currently employed, but I've been experiencing some fluctuations in my income. I'm expecting a raise soon, but I'm not sure when that will happen.",neutral,casual
SPEAK_TO_AGENT,"The bank has contacted a customer regarding a past-due mortgage payment that is now 45 days overdue. The customer has been experiencing issues with the bank's automated phone system, which has resulted in them being disconnected multiple times. They are concerned about the potential consequences of not making payments and want to speak with a human agent to explain their situation, verify their payment history, and explore options for temporary forbearance or a hardship plan.","

Bot: Hi there, this is [Bank Representative] from [Bank Name]. I'm calling to discuss your mortgage account with you. We've noticed that your payment is past due, and I want to make sure we get you back on track.

User: Ugh, finally someone who can actually talk to me. I've been on hold with your automated system for what feels like hours, only to get disconnected three times. I'm really frustrated.

Bot: I apologize for the inconvenience you've experienced with our automated system. I'm here to help, and I want to assure you that we're committed to working with you to resolve this situation. Can you please confirm your account information so I can access your records?

User: My account's not the problem, it's the system that's the problem. Look, I know I'm past due, but I need to talk to someone about this. I'm worried about what's going to happen if I don't make the payment. Can you just tell me what's going on and what my options are?

Bot: I understand your concerns, and I'm happy to help. Let me review your account history. Based on what I see, your mortgage payment is indeed 45 days past due. However, we do offer temporary forbearance or hardship plans that might be able to help you get back on track. Can you please tell me a little bit about what's been going on and what's caused the delay in your payment?

User: Look, I've been dealing with some unexpected medical bills, and my income's been affected. I've been trying to make payments, but I just can't keep up right now. I need some help, and I need it fast.

Bot: I'm so sorry to hear that you're dealing with medical bills. We're here to help, and we want to work with you to find a solution. Can I explain the temporary forbearance or hardship plan options to you, and we can discuss which one might be the best fit for your situation?

User: Yeah, that would be great. Just please, can you just tell me what my options are and what I need to do to get back on track?",angry,casual
SPEAK_TO_AGENT,"The bank has contacted a customer regarding a past-due mortgage payment that is now 45 days overdue. The customer has been experiencing issues with the bank's automated phone system, which has resulted in them being disconnected multiple times. They are concerned about the potential consequences of not making payments and want to speak with a human agent to explain their situation, verify their payment history, and explore options for temporary forbearance or a hardship plan.","

Bot: Hi there, this is a representative from Oakwood Bank calling about your mortgage account. How are you today?

User: ugh, i'm frustrated. i've been trying to call the bank to talk to someone about my payments but the automated phone system keeps kicking me off. can someone just talk to me for a sec?

Bot: I'm so sorry to hear that you're experiencing issues with our phone system. I'd be happy to help you today. Can you please confirm your name and the account type you're calling about so I can pull up your information?

User: my name is john smith and i have a mortgage with the bank. i think it's about 45 days overdue? i've been trying to make payments but the automated system just keeps cutting me off before i can finish.

Bot: I've located your account, John. I want to assure you that we're here to help. Can you tell me a little bit about what's been going on with your payments? Has something unexpected come up that's causing you to be behind?

User: yeah, i've been dealing with some family stuff and my income has been a bit unpredictable lately. i'm worried about the consequences of not making payments, though. what happens if i don't catch up on this?

Bot: I understand your concerns, John. In this situation, we'd like to explore some options with you to help you get back on track. One possibility is our hardship plan, which can provide temporary relief on your payments. Another option might be a forbearance agreement, which would pause or reduce your payments for a set period of time. Let me explain those options in more detail and see which one might be the best fit for you.

User: that sounds good. can you walk me through what those options look like in more detail?",confused,casual
CREDIT_SCORE_QUERY,"The bank has contacted a customer about a past-due student loan balance that is now 60 days overdue. The customer, a graduate student struggling to make ends meet due to a part-time job with limited hours, is worried about how this delinquency will impact their credit score and whether it could jeopardize their ability to qualify for future student loans. They are seeking clarity on whether this overdue balance has already been reported to the credit bureaus and what potential effects it could have on their credit score.","

Bot: Hello, this is [Bank Name] reaching out regarding your account. We wanted to follow up on a past-due balance on your student loan. Can you please confirm your identity so we can discuss this matter further?

User: Good morning. Yes, I can confirm my identity. I'm aware that the balance is past due, but I was wondering if you could provide some information about its status. Specifically, has this overdue balance been reported to the credit bureaus yet?

Bot: Thank you for confirming your identity. I'd be happy to provide you with an update. Our records indicate that the overdue balance is currently 60 days past due. However, we have not yet reported this delinquency to the credit bureaus. We typically report delinquencies to the credit bureaus after 90 days.

User: That's good to know. I appreciate your transparency. However, I do have some concerns about the potential impact on my credit score. Will this overdue balance significantly affect my credit score, and could it jeopardize my ability to qualify for future student loans?

Bot: I understand your concerns, and I'm happy to provide you with some general information. Delinquencies, especially those reported to the credit bureaus, can negatively affect credit scores. However, since this balance is still within our 90-day reporting threshold, it's unlikely to have a significant impact on your credit score at this time. That being said, it's essential to continue making payments to avoid further delinquencies and potential long-term credit score damage.

User: Thank you for the information. I appreciate your clarification. In that case, I'll make sure to prioritize paying off this balance as soon as possible. Do you have any recommendations on how I can make a payment or set up a payment plan to get back on track?

Bot: I'm glad you're committed to resolving the issue. Since this is a one-time conversation, I can guide you through the process of making a payment or setting up a payment plan over the phone. However, if you'd like to discuss further or have any questions, please feel free to reach out to us directly. We're here to help.",neutral,professional
CREDIT_SCORE_QUERY,"The bank has contacted a customer about a past-due student loan balance that is now 60 days overdue. The customer, a graduate student struggling to make ends meet due to a part-time job with limited hours, is worried about how this delinquency will impact their credit score and whether it could jeopardize their ability to qualify for future student loans. They are seeking clarity on whether this overdue balance has already been reported to the credit bureaus and what potential effects it could have on their credit score.","

Bot: Hello, this is a representative from your bank. We wanted to reach out to you regarding a past-due balance on your student loan. Can you tell me a little bit about what's going on and why you're having trouble making payments?

User: Thank you for reaching out. I appreciate your concern. I've been working a part-time job, but unfortunately, my hours have been limited, and it's been challenging to make ends meet. I'm worried that this overdue balance might have a negative impact on my credit score.

Bot: I completely understand your situation. We're here to help. I'd like to assure you that we're not looking to penalize you, but rather to work together to get your account back on track. Can you tell me a bit more about your credit score concerns? Have you heard from any credit bureaus about this overdue balance?

User: Yes, I've been doing some research, and I'm worried that since this balance is 60 days overdue, it may have already been reported to the credit bureaus. If that's the case, I'm concerned it could lower my credit score significantly.

Bot: I see. In that case, I can check on that for you. However, I want to let you know that we follow the Fair Credit Reporting Act, which means we typically only report overdue accounts to the credit bureaus after they are 90 days past due. But I'll go ahead and confirm that for you. Can you please hold for just a moment while I check on the status of your account?

User: Thank you, that would be great. I appreciate your help in clarifying this for me.

Bot: I've checked on your account, and it appears that we have not yet reported this overdue balance to the credit bureaus. However, to protect your credit score, I would recommend making a payment as soon as possible. If you're still experiencing difficulties, we may be able to discuss some alternative payment options with you.

User: That's a relief to hear. I'd like to make a payment as soon as possible. Can you tell me more about the alternative payment options you mentioned?

Bot: Absolutely. We have a few options available, such as setting up a payment plan or making a lump-sum payment. I'd be happy to discuss those options with you in more detail. Which one sounds most appealing to you?

User: I think a payment plan might be the best option for me. Can you walk me through the process of setting one up?

Bot: Of course. I'd be happy to guide you through the process. We'll work together to determine a payment amount and schedule that works for you.",neutral,professional
CREDIT_SCORE_QUERY,"The bank has contacted a customer about a past-due student loan balance that is now 60 days overdue. The customer, a graduate student struggling to make ends meet due to a part-time job with limited hours, is worried about how this delinquency will impact their credit score and whether it could jeopardize their ability to qualify for future student loans. They are seeking clarity on whether this overdue balance has already been reported to the credit bureaus and what potential effects it could have on their credit score.","

Bot: Hello, this is [Bank Name] calling about your account. We wanted to follow up on the past-due balance on your student loan. Can you please confirm your identity so we can discuss your account?

User: Hi, thank you for reaching out. I appreciate your concern about my account. However, I am a bit confused - I thought I was making payments on my student loan. How did this balance become past-due if I'm making regular payments?

Bot: Thank you for your question. It seems there might have been a miscommunication or an issue with our payment processing system. I'd be happy to help clarify this for you. Can you please tell me more about your payment schedule and when you last made a payment?

User: I think I made a payment about two months ago, but I'm not entirely sure. I've been having trouble keeping track of my finances lately due to my part-time job hours being reduced. I'm worried this overdue balance might have a negative impact on my credit score, which could make it harder for me to get future student loans.

Bot: I understand your concerns, and I'm here to help. In most cases, we report overdue accounts to the credit bureaus after they are 60 days past-due. However, I do not have information on whether this specific account has been reported yet. To answer your question, I would recommend checking your credit report to see if there are any discrepancies. If you'd like, I can also provide you with information on how to dispute any errors you might find.

User: Thank you for your guidance. I think I will go ahead and check my credit report. Can you please confirm that this overdue balance will indeed be reported to the credit bureaus if it remains past-due?

Bot: Yes, that's correct. If the balance remains past-due, we will report it to the credit bureaus. However, I want to emphasize that our goal is to work with you to find a solution to bring your account up to date. I'd be happy to discuss possible options with you, such as a payment plan, to help you avoid any further delinquency.",confused,professional
