intent,scenario,conversation_text,sentiment,user_speech_type
REQUEST_PAYMENT_PLAN,"The bank has reached out to a customer about a past-due balance on their student loan due to a reduction in work hours following a company-wide restructuring. Although the customer has since secured a new position with a similar salary, they are struggling to make ends meet and are unable to pay the full overdue amount at once. To avoid further penalties and protect their credit, they request a payment plan to repay the balance in six biweekly installments using their savings account, which they can reliably access for consistent payments.","

Bot: Hello, this is [Bank Name] reaching out about your account. We noticed that your student loan payment is past due and we're here to help you get back on track.

User: Yeah, I'm aware of the situation. I went through a bit of a rough patch after my old company downsized, but I've since found a new job with similar pay, so I'm good now.

Bot: That's great to hear that you've found a new opportunity! However, we still need to address the past-due balance. We want to work with you to find a solution that fits your needs.

User: I know, and I'm willing to make it right. I just can't pay the full amount all at once. Would it be possible to set up a payment plan to pay it off in installments?

Bot: Absolutely, we can definitely help you with that. What would be a more manageable schedule for you to pay off the balance? Would you prefer to make weekly or biweekly payments?

User: I think biweekly would be best for me since I know exactly when I'll be receiving my paychecks. And I'd like to use my savings account to make the payments, if that's okay.

Bot: That's perfectly fine. We'll set up the payment plan using your savings account for biweekly payments. Let me just confirm the details with you. We'll divide the balance into six payments, and the due date will be every other week. Is that correct?

User: Yeah, that sounds about right. I just need to make sure I can make the payments without any issues.

Bot: Of course, we'll make sure to send you reminders and notifications to ensure you stay on track. We'll also keep an eye on your account to make sure everything is progressing smoothly.",neutral,casual
REQUEST_PAYMENT_PLAN,"The bank has reached out to a customer about a past-due balance on their student loan due to a reduction in work hours following a company-wide restructuring. Although the customer has since secured a new position with a similar salary, they are struggling to make ends meet and are unable to pay the full overdue amount at once. To avoid further penalties and protect their credit, they request a payment plan to repay the balance in six biweekly installments using their savings account, which they can reliably access for consistent payments.","

Bot: Hello, this is [Bank Representative] from [Bank Name]. I'm reaching out regarding your student loan account, which has a past-due balance. How are you doing today?

User: I'm doing well, thank you for asking. I appreciate your time to discuss this matter. I'm aware of the past-due balance and am eager to resolve it. Unfortunately, my previous employer underwent restructuring, resulting in reduced work hours, which put me in a difficult financial situation. However, I've recently secured a new position with a similar salary, and I'm working to get back on track.

Bot: I'm glad to hear that you've secured new employment and are making progress towards resolving your financial situation. I'd be happy to help you explore options to pay off the past-due balance. Can you tell me a bit more about your current financial situation and what you're able to pay each month?

User: I'm able to make consistent payments, but I'm not in a position to pay the full amount at once. I was wondering if it would be possible to set up a payment plan to repay the balance over a period of time. I have a savings account that I can reliably access, and I'd like to use that to make payments. Would that be feasible?

Bot: I can definitely help you set up a payment plan. Before we proceed, I just want to confirm that you're aware of the total amount due and the interest that has accrued. Would you like me to provide you with that information?

User: Yes, please provide the details, and I'll review them. I'd like to ensure that I understand the total amount I need to repay, including any interest.

Bot: I've obtained the information, and I'll walk you through it. The total amount due is [amount], and the interest that has accrued is [interest amount]. This brings the total to [total amount]. With a payment plan, you can make six biweekly payments from your savings account to repay the balance.

User: Thank you for providing the information. I'll review it and confirm that I understand the total amount. I'm confident that this payment plan will allow me to repay the balance in a timely manner and avoid any further penalties. Can you please assist me with setting up the payment plan and ensuring that it's processed correctly?

Bot: I'd be happy to help you set up the payment plan. I'll guide you through the process, and we'll get everything in place.",neutral,professional
REQUEST_PAYMENT_PLAN,"The bank has reached out to a customer about a past-due balance on their student loan due to a reduction in work hours following a company-wide restructuring. Although the customer has since secured a new position with a similar salary, they are struggling to make ends meet and are unable to pay the full overdue amount at once. To avoid further penalties and protect their credit, they request a payment plan to repay the balance in six biweekly installments using their savings account, which they can reliably access for consistent payments.","

Bot: Hi there, this is a representative from [Bank Name] calling about your student loan account. We wanted to reach out to you about your recent payment due to a past-due balance.

User: wth r u caling bout? cant u see i dont hav enuf $$?!

Bot: I understand you're concerned, and I'm here to help. We've noticed that you've had a reduction in income due to a change in your work hours. However, we've also been informed that you've secured a new position with a similar salary.

User: yea, thats rite! but its hard 2 make ends meet rn. cant pay all thats owed rn.

Bot: I understand that this is a challenging time for you. We want to work with you to find a solution that fits your needs. Can you tell me a little more about your current financial situation and what you're hoping to accomplish with regards to your loan payments?

User: well, i can pay somethin. jus not all at once. wud it b possibl 2 set up a paymnt plan?

Bot: Absolutely, we can definitely help you set up a payment plan. We want to ensure you're able to pay your balance without taking on any additional stress. What kind of payment plan would you be looking for? Would you be able to make consistent payments over a set period of time?

User: yea, thats wut i need. can i pay 6 payments of biweekly? that way i can use my savings acct 2 make payments.

Bot: I think that's a great idea. Let's take a look at your account and see what we can set up for you. Can you confirm your savings account information with me, and I'll go ahead and create a payment plan that works for you?",angry,typos
SCHEDULE_PAYMENT,"A customer's home equity line of credit payment is past due, and the bank has reached out to notify them about the missed payment. The customer explains that they have been experiencing financial difficulties due to a recent divorce and requests to schedule a payment of $1,000 on September 15th using their savings account ending in 9012.","

Bot: Hello, this is [Bank Name] reaching out about your home equity line of credit. We wanted to follow up on your recent statement that showed a past-due balance.

User: oh hi ther i no i hav been behnd on the paymnet cuz of some dificultys i hav been goin thru with my ex and the divorce has been causin alot of stress

Bot: I'm so sorry to hear that, divorce can be a very challenging time. We're here to help you get back on track with your payments. Can you tell me a little bit more about your current financial situation and what you're hoping to do to catch up on the missed payment?

User: yeah i hav been strugglin to make ends meet and i need to pay some bills but i think i can come up with $1,000 to pay on the line of credit by sept 15th

Bot: That sounds like a good plan, $1,000 is a great step towards getting back on track. We have a few payment options available, including using an external bank account. Would you like to set up a payment using your savings account ending in 9012?

User: yea thats the one i hav that account and i think thats the one i want to use

Bot: Great, I've gone ahead and scheduled the payment from your savings account ending in 9012 for September 15th. You should receive a confirmation email with the details of the payment. If you have any other questions or concerns, feel free to reach out to us.",neutral,typos
SCHEDULE_PAYMENT,"A customer's home equity line of credit payment is past due, and the bank has reached out to notify them about the missed payment. The customer explains that they have been experiencing financial difficulties due to a recent divorce and requests to schedule a payment of $1,000 on September 15th using their savings account ending in 9012.","

Bot: Hi there, this is [Bank Name] calling. We wanted to reach out to you about your home equity line of credit account. Our records show that the last payment was missed. Can you please tell us a little bit about what's going on with your account?

User: Yo, yeah, I know I'm a bit behind. I've been goin through some stuff with my ex and it's been tough financially. I'm gettin back on track, but I need some help with the payment schedule.

Bot: I'm so sorry to hear that you're going through a tough time. We're here to help. Can you tell me a little bit more about your situation and what you're hoping to do with your account?

User: I'm good, just need to get back on track. I wanna pay $1,000 on September 15th. Can I set that up with my savings account that ends in 9012?

Bot: I'd be happy to help you set up a payment. However, can you confirm that you have sufficient funds in your savings account to cover the payment? We want to make sure everything goes smoothly.

User: Yeah, I got the cash. It's just a matter of getting it transferred to the right account. Can you walk me through the process of scheduling the payment, then?

Bot: Of course. To schedule a payment, I'll need to confirm your account information. Can you please confirm your account number and the account number for your savings account ending in 9012?",neutral,slang
SCHEDULE_PAYMENT,"A customer's home equity line of credit payment is past due, and the bank has reached out to notify them about the missed payment. The customer explains that they have been experiencing financial difficulties due to a recent divorce and requests to schedule a payment of $1,000 on September 15th using their savings account ending in 9012.","

Bot: Hi there, this is [Bank Representative] from [Bank Name]. We're reaching out to discuss your past-due balance on your home equity line of credit. Can you tell me a bit about what's going on and when we might expect the payment to be made?

User: Hi, yeah, I'm aware of the balance. To be honest, things have been tough for me lately. My divorce is still in the process, and it's been straining my finances. I've been trying to get back on track, but it's taking some time.

Bot: I'm so sorry to hear that you're going through this. We want to work with you to find a solution that fits your needs. Have you had a chance to review our payment options and see what might work best for you?

User: Honestly, I was thinking of making a payment of $1,000 on September 15th. I have some savings set aside in my account ending in 9012 that I can use for that. Would that be possible?

Bot: I'd be happy to help you set that up. Can you confirm that the account ending in 9012 is the one you'd like to use for the payment?

User: Yeah, that's the one. I've got the money available in that account, and I'd like to schedule the payment for September 15th.

Bot: I've gone ahead and scheduled the payment for you. You should receive an email confirmation with the details. If you have any questions or need further assistance, please don't hesitate to reach out.",neutral,casual
SCHEDULE_PAYMENT,"A customer's home equity line of credit payment is past due, and the bank has reached out to notify them about the missed payment. The customer explains that they have been experiencing financial difficulties due to a recent divorce and requests to schedule a payment of $1,000 on September 15th using their savings account ending in 9012.","

Bot: Hi ther, this is [Bank Name] calling about your home equity line of credit. You've recently missed a payment and we wanted to reach out to see how we can assist you.

User: wha r u talkin bout? i dnt rememr makin a late paymnt

Bot: I apologize if there was any confusion. We have a record of a missed payment on your home equity line of credit. Our records show that your payment was due on July 15th and was not received by our office.

User: ok... thats not rite... i was goin thru a lot with my divorce & stuff... i dnt know how i missed that

Bot: I understand that this can be a difficult time for you. We're here to help. Can you tell me a little bit more about what you're looking for in terms of making a payment on your home equity line of credit?

User: i wnt to pay $1,000 on sept 15th... i have that avilable in my savings accnt 9012... can u help me schedual that paymnt?

Bot: I'd be happy to help you set up a payment. To confirm, you'd like to make a one-time payment of $1,000 from your savings account ending in 9012 on September 15th. Is that correct?

User: yep thats rite... can u make shure its set?

Bot: I've gone ahead and scheduled the payment for you. You should receive a confirmation email from us with the details of the payment. If you have any other questions or concerns, please don't hesitate to reach out to us.",confused,typos
SCHEDULE_PAYMENT,"A customer's home equity line of credit payment is past due, and the bank has reached out to notify them about the missed payment. The customer explains that they have been experiencing financial difficulties due to a recent divorce and requests to schedule a payment of $1,000 on September 15th using their savings account ending in 9012.","

Bot: Hi there, this is an automated message from your bank. We wanted to reach out to you about your home equity line of credit account, which is currently past due. Can you please let us know if you're experiencing any difficulties making payments?

User: Yeah, I'm having a bit of a rough patch. My ex and I just got divorced, and it's been tough to manage my finances. I was expecting to make a payment, but I think it slipped my mind.

Bot: I'm so sorry to hear that. Divorce can be really challenging. We're here to help. Can you tell me a little bit about your payment history and what you're hoping to do to get caught up?

User: Well, I've been making payments on time for the most part, but the past two months have been a bit of a struggle. I think I can pay $1,000 this month if I schedule it.

Bot: Okay, I appreciate your honesty. Scheduling a payment in advance is a great idea. Can you confirm which savings account you'd like to use for the payment? You mentioned something about the account ending in 9012.

User: That's the one. I just need to make sure it goes through on September 15th, please.

Bot: Absolutely, I can set that up for you. I just need to verify that you're authorizing the payment from the savings account ending in 9012 on September 15th. Is that correct?

User: Yes, that's exactly right. Thank you for your help.

Bot: You're welcome. I've gone ahead and scheduled the payment for you. We'll make sure it processes on September 15th. If you have any other questions or concerns, feel free to reach out to us.",neutral,casual
FALLBACK,"The bank notifies the customer about an overdue student loan balance, but the customer asks if the bank has any job openings in their local branch.","

Bot: Hi there, this is [Bank Name] customer service. We're reaching out because our records show that you have a past-due balance on your student loan account. Can you please tell me a bit about what's going on and when you expect to make a payment?

User: um hi what's going on with my account? i thought i paid everything on time

Bot: I apologize for any confusion, but our records indicate that your payment was due on June 1st and hasn't been received yet. If you're having trouble making the payment, we may be able to work out a payment plan with you. Can you confirm your account information so we can discuss this further?

User: yeah i think i paid it but i'm not sure what's going on. also do you guys have any job openings in your local branch? my sister works here and she loves it

Bot: I apologize, but I'd be happy to help you with your account question. However, regarding job openings, I can suggest checking our company website for the most up-to-date information on available positions. Would you like me to provide you with the website address?

User: yeah that would be great thanks. also can i ask what's the dress code like around here? is it pretty casual?

Bot: The dress code for our employees is business casual, but I'd be happy to provide you with more information on our company culture and benefits if you're interested in applying for a position. However, let's focus on getting your account up to date first. Can you please confirm your account information so we can discuss a payment plan or payment method?

User: okay sure. my account info is 1234567. also do you have any recommendations for good restaurants around here?

Bot: Thank you for providing your account information. I've taken note of it. I'd be happy to provide you with some recommendations for local restaurants, but I want to make sure we get your account issue resolved first. Can you please tell me more about your payment situation, and we can discuss some options for getting your account up to date?",confused,casual
FALLBACK,"The bank notifies the customer about an overdue student loan balance, but the customer asks if the bank has any job openings in their local branch.","

Bot: Good day, this is an automated representative from XYZ Bank. We're reaching out to discuss your account with us. You have a past-due balance on your student loan, and we wanted to check in to see how we can help.

User: Thank you for reaching out. I'm aware of the balance, and I'll be getting to it shortly. In the meantime, I was wondering if you have any job openings in your local branch?

Bot: I appreciate your interest in our bank. However, I'm here to discuss your account. Can we focus on the balance for a moment? Would you like to set up a payment plan or discuss possible hardship options?

User: No, I'm fine, thank you. I was just curious about the job openings. We have a diverse community, and it would be great to see more opportunities available.

Bot: I understand your interest, but I'm afraid I'm not equipped to provide information on job openings. You may want to visit our website or visit your local branch to speak with a representative about potential opportunities. Meanwhile, let's get back to your account. Can I offer you assistance with making a payment or setting up a payment plan?

User: I see. Yes, I would like to set up a payment plan, but not through the phone. Could I please have the contact information for my local branch so I can schedule an appointment?

Bot: Absolutely. I'd be happy to provide that information for you. Your local branch's phone number is 555-1234, and their address is 123 Main St. You can also visit our website to schedule an appointment online. I'll go ahead and send you a confirmation email with the details.",neutral,professional
FALLBACK,"The bank notifies the customer about an overdue student loan balance, but the customer asks if the bank has any job openings in their local branch.","

Bot: Hi there, this is an automated message from Bank of America. We wanted to reach out to you regarding a past-due balance on your student loan account. Can you please log in to review the details?

User: wut r u talkin bout? i ain't got no loan

Bot: I apologize if there's been a misunderstanding. We have your loan account on file and it appears there's an overdue balance. Can you please check your account activity and let me know if you have any questions or concerns?

User: doe i gotta pay dat now? cuz i need a job, maybe u guys got some openings at the bank?

Bot: I understand that you're looking for employment opportunities, but I'm here to help with your loan account. Let me see if I can assist you with any payment options or arrangements. However, I'm not aware of any job openings at our local branch. If you're interested in working at Bank of America, I recommend checking our careers website for available positions.

User: cool, so u got some sweet benefits or somethin?

Bot: I'm glad you're interested in our bank, but I'd like to stay focused on your loan account. If you'd like, I can provide more information on payment plans or help you set up a payment schedule. Can you please let me know how I can assist you further?",confused,slang
FALLBACK,"The bank notifies the customer about an overdue student loan balance, but the customer asks if the bank has any job openings in their local branch.","

Bot: Hello, this is a representative from [Bank Name]. I'm reaching out to discuss your recent account activity regarding your student loan balance, which appears to be past due.

User: Thank you for reaching out. I appreciate your concern about my account. However, I was wondering if you have any job openings available in your local branch?

Bot: I'm glad you asked, but I'd be happy to focus on your account first. Can you please confirm your account information so we can discuss a payment plan for your student loan balance?

User: Of course, my account information is up to date. I'd like to discuss payment options, but I'm also genuinely interested in exploring opportunities at [Bank Name]. Could you please provide me with a list of current openings and the application process?

Bot: I understand your interest, but I'd like to address your account situation first. Have you experienced any financial difficulties that may have contributed to the past-due balance on your student loan? We're here to help you get back on track.

User: Yes, I've had some unexpected expenses this quarter. I'm working on finding ways to manage my finances better. In the meantime, I'd appreciate it if you could provide me with the information on job openings. It would be helpful for me to have that in case I need to make a change in the future.

Bot: I apologize, but our primary focus is on helping you with your account situation. I can provide you with a list of general job openings on our website, but I won't be able to provide information on specific openings in our local branch or the application process. If you're interested in exploring opportunities with our bank, I recommend checking our website for available positions.

User: Understood. I'll take a look at the website. Thank you for the information, and I'll work on resolving my account issue.",neutral,professional
FALLBACK,"The bank notifies the customer about an overdue student loan balance, but the customer asks if the bank has any job openings in their local branch.","

Bot: Hi there, this is an automated call from Bank of America. We wanted to reach out to you regarding a past-due balance on your student loan account.

User: Are you kidding me? I just paid that off last month. You're really reaching for ways to screw me over, huh?

Bot: I apologize if there's been a misunderstanding. We've checked our records and it appears there's still a balance due. Can you please confirm your account information so we can look into this further?

User: Look into it? You guys are a joke. Anyway, do you have any job openings at your local branch? I heard it's a great place to work.

Bot: I understand your frustration, but I'd be happy to help you with your job inquiry. However, I'm not sure if we have any openings available at our local branch. Could you please provide me with your resume so I can look into it for you?

User: Yeah, sure, I'll just drop off my resume at the branch. But seriously, what's going on with my account? This is ridiculous.

Bot: I apologize again for the inconvenience. I'd be happy to help you with your account issue. Can you please provide me with your account number so I can look into this further?

User: Fine. But can you at least tell me if you have any openings in the customer service department? That would be great.

Bot: I apologize, but I'm a bit limited in what I can assist with. I can try to direct you to the careers page on our website, but I won't be able to provide information on specific job openings or hiring processes.

User: Great, thanks for nothing.",angry,casual
