intent,scenario,conversation_text,sentiment,user_speech_type
PAY_NOW,"A customer received a collections notice for their overdue personal loan balance after missing payments due to a sudden medical emergency that resulted in unexpected expenses. After receiving a tax refund, they are now able to pay $5,012.19 immediately using their checking account ending in 1856.","

Bot: Hello, this is [Bank Name] Collections. We're reaching out regarding an overdue balance on your personal loan. Can you please confirm your name so we can better assist you?

User: Yeah, my name is Emily Wilson. I got your notice and I'm glad you called. I've been meaning to get in touch with you guys about this.

Bot: Hi Emily, thank you for confirming your identity. I'm sorry to hear you received a notice. We understand that sometimes unexpected expenses can arise. Can you please tell me a little bit about what's going on with the account? You haven't made a payment in a while, and we want to work with you to get it back on track.

User: Honestly, it's been a tough few months. I had a medical emergency and had some pretty unexpected expenses. But I just got my tax refund, and I'm in a better position to pay off the balance now. I'm looking to pay $5,012.19 immediately from my checking account.

Bot: I'm glad to hear you're in a better position to make a payment now, Emily. We appreciate your commitment to settling the balance. To confirm, you'd like to pay $5,012.19 today using your checking account, is that correct? And can you please confirm the account number ending in 1856 is the one you'd like to use for the payment?

User: Yeah, that's the one. I'd like to pay the full balance using my checking account ending in 1856. Can you let me know what the next steps are?

Bot: Great, Emily. To proceed with the payment, I'll guide you through the next steps. Please hold for just a moment while I process the information. I'll then provide you with a confirmation number and let you know when the payment will be processed.",neutral,casual
PAY_NOW,"A customer received a collections notice for their overdue personal loan balance after missing payments due to a sudden medical emergency that resulted in unexpected expenses. After receiving a tax refund, they are now able to pay $5,012.19 immediately using their checking account ending in 1856.","

Bot: Hello, this is [Bank Name] Collections. How can I assist you today?

User: This is ridiculous. I just received a collections notice and I'm still trying to pay off the loan. I was expecting to be contacted by now.

Bot: I apologize for any inconvenience or distress caused. Can you please confirm your loan account details so I can look into this further?

User: I'm not giving you any account information over the phone. I'll pay the balance when I'm ready, which will be now.

Bot: I understand your concern, and I'm here to help. However, to process the payment, I need to verify your account information. Can you please tell me the account type and the last four digits of the checking account you'd like to use to make the payment?

User: That's not going to happen. I've already arranged to pay the full balance of $5,012.19 using my checking account. I've verified the funds are available, and I expect this to be processed immediately.

Bot: I appreciate your cooperation. To confirm, I've located your account, and I see that the balance due is indeed $5,012.19. I've initiated the payment process using the account information provided. You should receive a confirmation within the next 24 hours.

User: See that it's done. I expect no further communication unless there's an issue with the payment.

Bot: You've been a valued customer, and we appreciate your prompt payment. If there's anything else I can assist you with, please don't hesitate to contact us.",angry,professional
PAY_NOW,"A customer received a collections notice for their overdue personal loan balance after missing payments due to a sudden medical emergency that resulted in unexpected expenses. After receiving a tax refund, they are now able to pay $5,012.19 immediately using their checking account ending in 1856.","

Bot: Hello, this is a representative from [Bank Name]. How can I assist you today?

User: I just received your collections notice and I'm extremely frustrated. I've been making timely payments on my loan, but due to a recent medical emergency, I fell behind. I've since received my tax refund and I'm prepared to settle my outstanding balance immediately.

Bot: I'm so sorry to hear about your medical emergency, and I appreciate your promptness in resolving the issue. Can you please confirm the amount you'd like to pay today?",angry,professional
PAY_NOW,"A customer received a collections notice for their overdue personal loan balance after missing payments due to a sudden medical emergency that resulted in unexpected expenses. After receiving a tax refund, they are now able to pay $5,012.19 immediately using their checking account ending in 1856.","

Bot: Hello, this is [Bank Name] calling about your personal loan account. We wanted to reach out to you regarding the recent notice you received regarding your overdue balance.

User: Thank you for contacting me. I received the notice and I'm glad you're reaching out. I've since resolved the issue that caused the missed payments.

Bot: I'm glad to hear that, and I apologize for any inconvenience we may have caused. Can you please confirm your identity so we can discuss your account further?

User: Of course. My name is [Name], and I have the account information readily available. I'd like to discuss the payment options available to me.

Bot: Great, thank you for confirming your identity. I'd be happy to help you discuss your options. We have a balance of $5,012.19 that's currently overdue. Can you please tell me a little bit about how you plan to bring your account up to date?

User: I've recently received a tax refund, and I'd like to pay the entire balance using my checking account. The account number ending in 1856 has sufficient funds to cover the payment.

Bot: That sounds great. To confirm, you'd like to make a one-time payment of $5,012.19 from your checking account ending in 1856 to bring your account up to date, correct?

User: That's correct. I'd like to proceed with the payment as soon as possible.

Bot: I'm going to go ahead and process the payment for you. Please allow a few moments for the transaction to complete. Once the payment has been processed, your account will be updated, and you'll receive a confirmation email.

User: Thank you for your assistance. I appreciate your help in resolving this matter.",neutral,professional
PAY_NOW,"A customer is 25 days past due on a credit card and, after the bank's reminder, wants to make a payment immediately using their savings account 5678. Their current balance is $5,000, and they wish to pay $2,500 now.","

Bot: Hi there, this is [Bank Name] calling about your credit card account. We wanted to follow up on your recent statement.

User: wha happnd w/ my accnt? i dnt rememr seein anythng bout a past due bal

Bot: Hi there, don't worry. We're just checking in about a balance that's due. You're currently 25 days past due on your payment. Can you tell me a little bit about your account?

User: i think i pmt late cuz i was havin some financial probs last mnth. i wanna pay my bal asap tho

Bot: I completely understand. We're here to help. To make a payment, we'll need to verify some information. Can you please tell me the account number you'd like to use to make the payment from?

User: i wanna pay w/ my savngs accnt 5678. can i do a pmt of $2500 now?

Bot: Great, thank you for letting us know. To confirm, you'd like to make a payment of $2500 from your savings account 5678. Before we process the payment, we just need to confirm your identity. Can you please verify your name and address on file with us?

User: yeah, my name is on file rite? my addr is 123 main st. can u pls process the pmt now?

Bot: I've verified your information, and everything looks good. I'm going to go ahead and process the payment of $2500 from your savings account 5678. You should receive a confirmation email with the details of the payment.",neutral,typos
PAY_NOW,"A customer is 25 days past due on a credit card and, after the bank's reminder, wants to make a payment immediately using their savings account 5678. Their current balance is $5,000, and they wish to pay $2,500 now.","

Bot: Hi there, this is an automated message from your bank. We're reaching out because we noticed that your credit card balance is past due. Can you please let us know if you're able to make a payment today?

User: Yeah, I can make a payment. I just need to transfer some funds from my savings account. I'll pay $2,500 now.

Bot: Great, thank you for letting us know. To confirm, you'd like to make a payment of $2,500 today using your savings account. Is that correct?

User: That's right. I just need to make sure everything goes smoothly. Can you tell me what account I should use to make the payment?

Bot: You'll be using your savings account number 5678 to make the payment. We'll process the payment as soon as we receive the funds. You can initiate the transfer through our online banking or mobile app.

User: Okay, I think that's all set then. I'll just go ahead and set up the transfer. Is there anything else I need to know?

Bot: That's all for now. We'll send you a confirmation email once the payment is processed. If you have any questions or concerns, feel free to reach out to us. Thank you for making your payment today!",neutral,casual
PAY_NOW,"A customer is 25 days past due on a credit card and, after the bank's reminder, wants to make a payment immediately using their savings account 5678. Their current balance is $5,000, and they wish to pay $2,500 now.","

Bot: Hello, this is an automated collection call from ABC Bank. We're calling to remind you that your credit card account is past due. Would you like to discuss your balance and make a payment today?

User: Thank you for reaching out. I'm aware of the balance. I'd like to make a payment now.

Bot: Great, I'd be happy to assist you. To confirm, your current balance is $5,000. You'd like to pay $2,500 today. Is that correct?

User: That's correct. I'd like to use my savings account 5678 to make the payment.

Bot: I've noted your payment details. I just need to confirm your account information. Can you please confirm your account name and the last four digits of your savings account number?

User: My account name is Johnson, and the last four digits of my savings account number are 7821.

Bot: Thank you, Mr. Johnson. I've located your account and verified the information. I'll proceed with processing your payment. You should receive an email confirmation once the payment is complete. Would you like to verify your email address for the confirmation?

User: Yes, my email address is [johnson@email.com](mailto:johnson@email.com).

Bot: I've updated your email address on file. We'll send the confirmation to that address once the payment is processed. I'll go ahead and process your payment now.",neutral,professional
PAY_NOW,"A customer is 25 days past due on a credit card and, after the bank's reminder, wants to make a payment immediately using their savings account 5678. Their current balance is $5,000, and they wish to pay $2,500 now.","

Bot: Hi there, this is [Bank Name] calling about your credit card account. I wanted to reach out to you because we've noticed that you're 25 days past due on your payment.

User: wth? i thought i paid it last month. what's going on?

Bot: I'm happy to help you get caught up on your account. Can you please confirm your account information so I can pull up your details?

User: my account info is all good, i just need to pay the past due balance. how much do i owe again?

Bot: Your current balance is $5,000, and you have a past due balance of $2,500. To get your account current, we'd like to have that amount paid as soon as possible.

User: okay, i've got that. can i pay it using my savings account 5678? how do i do that?

Bot: Yes, you can definitely pay using your savings account. To do so, you'll need to make a one-time payment from your savings account to your credit card account. You can do this by logging into your online banking or by calling our payment center to make the payment over the phone.

User: online banking, got it. how long will it take to process the payment?",confused,casual
PAY_NOW,"A customer is 25 days past due on a credit card and, after the bank's reminder, wants to make a payment immediately using their savings account 5678. Their current balance is $5,000, and they wish to pay $2,500 now.","

Bot: Hi there, this is [Bank Name] reaching out regarding your account. We wanted to follow up on the past due balance on your credit card.

User: Yeah, I'm aware of it. I've been meaning to get to it, but I've been pretty busy lately. What's the current balance?

Bot: Your current balance is $5,000, and the past due amount is $2,500. We're here to help you get back on track. Are you able to make a payment today?

User: Yeah, I'd like to pay $2,500 using my savings account 5678. Can I do that online or over the phone?

Bot: You can definitely make a payment online or over the phone. To make a payment online, you can log in to your account on our website and follow the payment instructions. If you'd prefer to make a payment over the phone, you can call us at [phone number]. Which option sounds more convenient to you?

User: I'll just go online then. Can you give me the account number I need to enter for the payment?

Bot: The account number is the same as your credit card account. You can find it on your statement or by logging in to your account online. Once you're logged in, go to the ""Make a Payment"" section and select the account you want to pay.",neutral,casual
SPEAK_TO_AGENT,"The bank has reached out to a customer about their overdue credit card balance. The customer states they have been experiencing financial difficulties due to a recent business venture that failed, resulting in significant losses. They want to speak to a human agent to discuss possible hardship options, such as a payment plan or temporary reduction in payments, to avoid further negative consequences on their credit.","

Bot: Hi there, this is [Bank Name] calling about your account. We noticed that your credit card balance is currently past due.

User: Oh no, hi there. I'm so confused about all this. I thought I was good on my payments. What's going on?

Bot: I'd be happy to help you understand the situation. Can you tell me a little bit about your account and when you last made a payment?

User: Um, I think I last paid in March. But we've been having some financial issues at our business. We invested in a project that didn't work out and we've been trying to recoup our losses. It's been tough.

Bot: I understand that unexpected financial setbacks can be challenging. Let's take a closer look at your account. Can you tell me more about this business venture and how it's affecting your ability to pay your credit card balance?

User: Yeah, we sunk a lot of money into a startup that we thought was going to be a sure thing. But it turned out to be a huge loss. We've been trying to get back on our feet, but it's taking longer than expected. I'm worried about my credit score if I don't get this situation under control.

Bot: I see. It sounds like you're facing some significant financial challenges right now. I'm happy to discuss possible hardship options with you to see what we can do to help. Would you like to speak with one of our agents to explore some options, such as a payment plan or temporary reduction in payments?

User: Yeah, that would be amazing. I just want to get things back on track and avoid any further damage to my credit. Thank you so much for understanding.

Bot: You're welcome. I'm going to go ahead and transfer you to one of our agents who will be happy to help you work out a plan. They'll be able to discuss the details with you and answer any questions you may have. Is there anything specific you'd like to talk about or any questions you have before we transfer the call?

User: No, I think that's all for now. Just getting everything sorted out would be great. Thank you again.

Bot: You're welcome. I'm going to go ahead and transfer the call now. Our agent will be right with you.",confused,casual
SPEAK_TO_AGENT,"The bank has reached out to a customer about their overdue credit card balance. The customer states they have been experiencing financial difficulties due to a recent business venture that failed, resulting in significant losses. They want to speak to a human agent to discuss possible hardship options, such as a payment plan or temporary reduction in payments, to avoid further negative consequences on their credit.","

Bot: Hi there, this is a representative from [Bank Name]. We're reaching out because your account is past due on the credit card balance. Can you please confirm your identity so we can discuss this further?

User: Ugh, great. Another bill collector. Look, I don't have time for this. I've been dealing with my own stuff, okay? My business just tanked and I'm drowning in debt. Can I just talk to someone who can actually help me?

Bot: I apologize if this conversation has caught you at a bad time. We understand that financial difficulties can be challenging. I'm here to help you explore options to get back on track. Can you tell me a bit more about your business venture and what happened? This might help me better understand your situation.

User: It was a restaurant, okay? I invested everything I had and it failed. I'm talking tens of thousands of dollars down the drain. And now I'm stuck with this credit card debt on top of everything else. I just can't afford to pay it all back right now.

Bot: I'm so sorry to hear that. It sounds like a really tough situation. We have programs in place to help customers who are experiencing financial hardship. One option might be a payment plan that allows you to make smaller payments over time. Another option could be a temporary reduction in payments. Can you tell me what you think would be most helpful in your situation?

User: A payment plan sounds like it might work for me. But I need something that's going to give me some breathing room, you know? I need to get my finances sorted out before I can even think about paying off this debt.

Bot: Okay, I can definitely look into that for you. Can you give me a bit more information about your income and expenses? This will help me better understand what we can do to help.",angry,casual
SPEAK_TO_AGENT,"The bank has reached out to a customer about their overdue credit card balance. The customer states they have been experiencing financial difficulties due to a recent business venture that failed, resulting in significant losses. They want to speak to a human agent to discuss possible hardship options, such as a payment plan or temporary reduction in payments, to avoid further negative consequences on their credit.","

Bot: Good morning, this is an automated representative from ABC Bank. We're calling to discuss your current account balance. Can you please confirm your name?

User: Yes, my name is Emily Wilson. I'm not sure why you're calling me, but I did receive a notification about my credit card balance being overdue. I'd appreciate it if you could explain the situation.

Bot: Thank you, Ms. Wilson. We've noticed that your account is past due by approximately $2,500. Our records indicate that you've been making payments, but they haven't been sufficient to cover the full balance. We're reaching out to discuss possible options to help you get back on track.

User: I see. Well, I've been experiencing some financial difficulties due to a recent business venture that unfortunately didn't work out. We invested a significant amount of money and ended up losing it all. I've been trying to catch up on my payments, but it's been challenging.

Bot: I understand that unexpected setbacks can be difficult to navigate. We're here to help you find a solution that works best for you. Can you tell me a bit more about your current financial situation and what you're hoping to achieve with your account?

User: I'd like to discuss possible hardship options, such as a payment plan or temporary reduction in payments. I'm concerned that if I don't address this situation soon, it could negatively impact my credit score.

Bot: I'd be happy to help you explore those options. Can you please hold for just a moment while I transfer you to one of our representatives who specializes in hardship cases? They'll be able to discuss the details with you and provide guidance on the best course of action.

User: That sounds great, thank you. I appreciate your help, and I look forward to speaking with someone soon.",confused,professional
SPEAK_TO_AGENT,"The bank has reached out to a customer about their overdue credit card balance. The customer states they have been experiencing financial difficulties due to a recent business venture that failed, resulting in significant losses. They want to speak to a human agent to discuss possible hardship options, such as a payment plan or temporary reduction in payments, to avoid further negative consequences on their credit.","

Bot: Hi there, this is a representative from [Bank Name]. We're calling about your account with us. Can you please confirm your name and account information so we can better assist you?

User: i cant confirm anythin right now, can i pleez speak to a human?

Bot: Of course, I'd be happy to transfer you to a representative who can help you with your account. Can you please hold for just a moment while I connect you?

User: ok, i will hold. btw, is this about the credit card i hav? i been havin some issues payin it off

Bot: Yes, this is about your credit card account. I'm transferring you to a representative now. Please hold for just a moment.

User: thank you. hi, my name is [Customer Name] and i think i owe some money on my credit card

Bot: Hi [Customer Name], thank you for holding. I'm [Representative Name] and I'll be happy to help you with your account. Can you please tell me a little bit about what's been going on with your payments and what's causing the difficulty?

User: well, i recently invested in a business venture and it didnt go as planned. we lost a lot of money and i havent been able to pay my bills as usual

Bot: I'm so sorry to hear that, [Customer Name]. That can be really tough. Can you tell me a little bit more about the business venture and how it's affecting your finances?

User: yeah, we thought it was a good idea at the time, but it turned out to be a bad investment. we lost a lot of money and now i have to try to pay off debts and other expenses

Bot: I understand. It sounds like you're facing some significant financial challenges right now. Can we discuss some options that might be able to help you get back on track with your payments? We have hardship programs in place that could potentially reduce your payments or provide some temporary relief. Would you like me to explain those options to you?",neutral,typos
SPEAK_TO_AGENT,"The bank has reached out to a customer about their overdue credit card balance. The customer states they have been experiencing financial difficulties due to a recent business venture that failed, resulting in significant losses. They want to speak to a human agent to discuss possible hardship options, such as a payment plan or temporary reduction in payments, to avoid further negative consequences on their credit.","

Bot: Hey there, we noticed your credit card balance is past due. Can you tell us a little bit about what's going on?

User: wassup bank? i thought i was good on my payments, but i just got hit with a buncha losses from my biz venture. now i'm swimmin in debt.

Bot: Sorry to hear that, we're here to help. Can you tell us a bit more about what happened with your business? We want to make sure we understand the situation so we can find a solution that works for you.

User: dude, it's a long story. basically, i started this new venture thinkin it was gonna be the next big thing, but it tanked. i lost like, a buncha cash. now i'm strugglin to keep up with my payments, let alone pay off the balance.

Bot: I'm sorry to hear that. It can be really tough when a business venture doesn't pan out. Have you talked to anyone else about your financial situation, like a financial advisor or a credit counselor?

User: nah, just been tryin to figure it out on my own. i don't wanna be in debt forever, but i don't know how to get outta this hole. that's why i wanna talk to a human, not just some automated system.

Bot: We completely understand, and we're happy to have a human agent talk to you about your situation. We can discuss some hardship options that might be available to you, such as a payment plan or temporary reduction in payments. Can you tell me a little bit more about what you're hoping to achieve by talking to us?

User: yeah, i just wanna find a way to get back on track without totally wreckin my credit. i know i messed up, but i'm tryin to do better. can you help me out?

Bot: Absolutely, we're here to help. Let me go ahead and transfer you to one of our agents who can discuss your situation with you in more detail.",confused,slang
