intent,scenario,conversation_text,sentiment,user_speech_type
SPEAK_TO_AGENT,"The bank has contacted a customer about a past-due credit card balance that is now 90 days overdue. The customer explains they recently experienced a medical emergency requiring a costly hospital stay, and their insurance provider delayed payment, leaving them with a significant financial burden. They are overwhelmed by the collection notice and want to speak directly with a human agent to discuss possible hardship options, such as a payment plan or temporary reduction in payments, to avoid further negative consequences on their credit.","

Bot: Hello, this is an important message from [Bank Name] regarding your account. We wanted to reach out to you about a past-due balance on your credit card that is now 90 days overdue.

User: Hi, yeah, I got your notice. I'm trying to catch up on it, but things have been really tough lately.

Bot: I'm so sorry to hear that. Can you please tell me a little bit more about what's been going on? We're here to help and want to make sure we're understanding your situation correctly.

User: Well, I recently had a pretty serious medical emergency and had to spend some time in the hospital. The bills are just piling up, and my insurance provider is still taking a while to sort everything out.

Bot: I'm so sorry to hear that you're going through this. It sounds like a really challenging time. Can you tell me a little bit more about how the insurance delay has affected your finances?

User: Honestly, it's been a huge burden. They're supposed to pay me back, but they're still disputing some of the charges, and it's taking forever. In the meantime, I'm just trying to keep up with my regular bills and this credit card payment, but it's getting really tough.

Bot: I understand that this can be really stressful and overwhelming. I'd like to see what options we might have available to help you get back on track. Would you like to discuss setting up a payment plan or temporarily reducing your payments to make it more manageable for you?

User: Yeah, that would be great. I just want to avoid getting any more negative marks on my credit, and I'm willing to work with you to find a solution that works for both of us.

Bot: Okay, let's go ahead and explore those options. I'll also go ahead and document our conversation so we can keep track of our progress. Can you please confirm your name and contact information so I can get started on setting up a payment plan for you?",neutral,casual
SPEAK_TO_AGENT,"The bank has contacted a customer about a past-due credit card balance that is now 90 days overdue. The customer explains they recently experienced a medical emergency requiring a costly hospital stay, and their insurance provider delayed payment, leaving them with a significant financial burden. They are overwhelmed by the collection notice and want to speak directly with a human agent to discuss possible hardship options, such as a payment plan or temporary reduction in payments, to avoid further negative consequences on their credit.","

Bot: Hello, this is an important message from our bank regarding your account. We've noticed that your past-due credit card balance is now 90 days overdue.

User: I just received the collection notice and I'm extremely frustrated. I'd like to speak with a real person to discuss my situation. I'm not sure how I'm going to pay this off.

Bot: I understand your concern and I'm happy to help. Can you please tell me a little bit about what's been going on and what led to the past-due balance? This will help me assist you more effectively.

User: Recently, I had a medical emergency that required a hospital stay. I'm still trying to get my insurance provider to cover the costs, but they're taking their sweet time. In the meantime, I've been left with a significant financial burden. I've been making payments as best I can, but it's clear that I need some kind of hardship option to get back on track.

Bot: I'm so sorry to hear that you're going through this, and I appreciate you sharing the details with me. It sounds like you're experiencing a difficult situation. I'd be happy to explore some hardship options with you, such as a payment plan or temporary reduction in payments, to help you avoid further negative consequences on your credit.

User: That would be a huge relief. I'm worried that if I don't get this situation under control, it'll be catastrophic for my credit score. I just want to be able to make a plan and stick to it, but I need some help to make that happen.

Bot: Don't worry, we're here to help. I'm going to go ahead and document your request for a hardship plan. One of our agents will be in touch with you shortly to discuss the details and come up with a solution that works for you. Is there a phone number where you can be reached, or would you prefer to communicate via email?

User: Just my cell phone number is fine. I'll be available to take calls and respond to messages throughout the day.

Bot: Great, I've noted your cell phone number. We'll be in touch with you soon to discuss your hardship plan. In the meantime, please know that we're committed to working with you to find a solution that meets your needs.",angry,professional
SPEAK_TO_AGENT,"The bank has contacted a customer about a past-due credit card balance that is now 90 days overdue. The customer explains they recently experienced a medical emergency requiring a costly hospital stay, and their insurance provider delayed payment, leaving them with a significant financial burden. They are overwhelmed by the collection notice and want to speak directly with a human agent to discuss possible hardship options, such as a payment plan or temporary reduction in payments, to avoid further negative consequences on their credit.","

Bot: Hi there, this is [Bank Name] reaching out about your credit card account. We wanted to follow up on the past-due balance that's now 90 days overdue.

User: Oh, hi... I'm kinda confused about this. I know I've been trying to pay you guys, but I just got slammed with some medical bills. My insurance was supposed to cover most of it, but they're still processing my claim.

Bot: I'm so sorry to hear that, [Customer Name]. Medical emergencies can be incredibly stressful and financially overwhelming. Can you tell me a bit more about your situation? How much are you currently behind on your payments?

User: Um, I think it's like $2,500 or something? I know it's a lot, but like I said, I've been waiting on my insurance to pay me. They promised to reimburse me, but it's taking forever. I'm starting to get worried about my credit score.

Bot: I understand your concern. We're here to help. Have you received any communication from our previous messages or letters regarding this past-due balance?",confused,casual
SPEAK_TO_AGENT,"The bank has contacted a customer about a past-due credit card balance that is now 90 days overdue. The customer explains they recently experienced a medical emergency requiring a costly hospital stay, and their insurance provider delayed payment, leaving them with a significant financial burden. They are overwhelmed by the collection notice and want to speak directly with a human agent to discuss possible hardship options, such as a payment plan or temporary reduction in payments, to avoid further negative consequences on their credit.","

Bot: Hi there, this is an automated call from XYZ Bank. I'm calling to discuss your account with account holder. Your account is currently past due and we're reaching out to see how we can help. 

User: Hi, yeah I got that message. I'm a bit overwhelmed right now, can I please speak to a person about this? I'd like to discuss some options with someone who can actually help me.

Bot: I completely understand, and I'm happy to assist you. However, I do want to let you know that speaking with a live agent will take a moment. Would you like to hold for just a minute while I connect you? 

User: Yeah, sure. Go ahead and do that. I just need to talk to someone about this. I recently had a pretty serious medical emergency and my insurance is dragging its feet on the payments. I'm trying to get everything sorted out, but it's tough.

Bot: I'm so sorry to hear that, and I appreciate you sharing that with me. I'm going to go ahead and connect you with one of our agents who can help you explore some options for your account. Please hold for just a moment.

User: Thanks, I appreciate it. I just need to figure out how to get this all taken care of without ruining my credit even more.

Bot: Of course, you're welcome. I'm going to go ahead and transfer you to our collections department. Someone will be with you shortly to discuss your account and see what options are available to you.

User: Alright, thanks again. I'll talk to them soon.",neutral,casual
SPEAK_TO_AGENT,"The bank has contacted a customer about a past-due credit card balance that is now 90 days overdue. The customer explains they recently experienced a medical emergency requiring a costly hospital stay, and their insurance provider delayed payment, leaving them with a significant financial burden. They are overwhelmed by the collection notice and want to speak directly with a human agent to discuss possible hardship options, such as a payment plan or temporary reduction in payments, to avoid further negative consequences on their credit.","

Bot: Hello, this is [Bank Representative] from [Bank Name]. How can I assist you today?

User: oh hi ther i just recived a letetr from you about my credt card balans bein past due i wasnt aware of this

Bot: I apologize for any confusion. We've sent out a notice regarding your account due to a past-due balance. Can you please confirm your account information so I can access your account details?

User: my accnt info is all good i just need to talk to somone about this cuz its kinda emergent

Bot: I understand that this is an urgent matter for you. Can you please tell me a little bit more about what's going on? What's been happening with your account that led to the past-due balance?

User: its a long story but i recently had a medecal emergensy that requrd a hospitol stay my insurnce co didnt pay me till last week so i havent had the $$$ to pay the credt card balans

Bot: I'm so sorry to hear that you're going through this. Medical emergencies can be very costly and unpredictable. I want to assure you that we're here to help. Can you please tell me more about your current financial situation and what you're able to pay towards your balance?

User: to be honest i dont know how im gonna pay it all off but i need somethin to pay it off in installments or somethin cuz i dont wanna get in deeper debt

Bot: I completely understand your concern. We have some options available for customers who are experiencing financial hardship. I'd like to discuss a payment plan with you that could help you make manageable payments towards your balance. Would you be open to exploring this option?",neutral,typos
SETUP_AUTOPAY,"The bank has contacted a customer about their overdue credit card payment, which resulted from a recent medical emergency and hospitalization that led to significant expenses. Although they've since recovered and are now back on their feet, the customer expresses concern about missing another payment due to their busy schedule. To ensure they stay on top of their payments, they request to set up automatic payments on the 25th of each month from their primary checking account.","

Bot: Hi there, this is [Bank Name] calling about your account. We wanted to reach out to you regarding your recent payment due to a past-due balance.

User: wha r u calin bout?? i just got a letter from u guys sayin i owe money. i dont rememba makin a late paymnt.

Bot: I understand you might be a bit confused. We're calling about your credit card account. Unfortunately, we did receive a letter about a past-due balance. However, I'd like to help you get back on track. Can you please confirm your account information so we can discuss possible solutions?

User: ok i think its ok. i had a medical emergncy last month and ended up in the hospitol. i had alot of expensses and i think thats why i missed the paymnt.

Bot: I'm so sorry to hear that you went through a medical emergency. We understand that unexpected expenses can be challenging to manage. We're here to help you get back on your feet. One option we can discuss is setting up automatic payments to ensure you never miss another payment.

User: thats a gud idear!! i wanna make shure i pay on time from now on. can u pls tel me how to set it up?

Bot: Absolutely! To set up automatic payments, we'll need to link your primary checking account to your credit card account. This will allow us to deduct the payment amount on the 25th of each month. Would you like me to walk you through the process?

User: yessss!! the 25th of each month sounds perfict. lets do it!!",confused,typos
SETUP_AUTOPAY,"The bank has contacted a customer about their overdue credit card payment, which resulted from a recent medical emergency and hospitalization that led to significant expenses. Although they've since recovered and are now back on their feet, the customer expresses concern about missing another payment due to their busy schedule. To ensure they stay on top of their payments, they request to set up automatic payments on the 25th of each month from their primary checking account.","

Bot: Hi there, this is [Bank Name] calling about your credit card account. We wanted to follow up on your recent payment that's currently overdue.

User: Oh, hi! Yeah, I'm so sorry about that. I had a bit of a medical emergency and hospitalization recently, and things got pretty crazy. I'm all caught up now, but I'm worried about missing another payment because I'm super busy with work and stuff.

Bot: Sorry to hear that you had a tough time. We're glad you're feeling better now. Don't worry, we're here to help. Can you tell me a bit more about what's going on and how we can support you in getting back on track?

User: Honestly, I'm just really overwhelmed with work and taking care of some other stuff at home. I'm worried that if I don't set up some kind of automatic payment system, I'll forget to pay my credit card bill again.

Bot: We completely understand. Setting up an automatic payment plan can be a huge help in making sure you never miss a payment again. Let's go ahead and set up a payment plan for you. What date would you like to set as the payment due date? Would you like it to be the same day every month, or would you prefer a specific date?

User: Yeah, that would be awesome! Can I set it up to pay on the 25th of each month? That way, I'll know exactly when the payment is due and I can make sure to transfer the funds from my checking account on time.

Bot: The 25th of each month it is, then. I've gone ahead and set that up for you. You'll receive a confirmation email with all the details, but just to confirm, your payment will be automatically deducted from your primary checking account on the 25th of each month.

User: Awesome, thank you so much! I really appreciate it. I feel a lot better now knowing that I won't have to worry about missing another payment.

Bot: You're welcome! We're happy to help. If you have any questions or need further assistance, please don't hesitate to reach out.",confused,casual
SETUP_AUTOPAY,"The bank has contacted a customer about their overdue credit card payment, which resulted from a recent medical emergency and hospitalization that led to significant expenses. Although they've since recovered and are now back on their feet, the customer expresses concern about missing another payment due to their busy schedule. To ensure they stay on top of their payments, they request to set up automatic payments on the 25th of each month from their primary checking account.","

Bot: Hi there, this is an automated message from your bank. We wanted to reach out about your past-due credit card balance. Can you please confirm your identity so we can discuss further?

User: Yeah, I'm [Customer Name]. What's going on with my account? I know I'm a bit behind on the payment, but I'm getting back on my feet after a recent medical emergency.

Bot: Sorry to hear that, [Customer Name]. We're glad to hear you're recovering. Our records show that your payment due date was missed, and we're here to help you get back on track. Are you currently able to make a payment today or would you prefer to discuss alternative options?

User: Honestly, I'm pretty busy this week, and I'm not sure if I can get to it. I'd rather not miss another payment, though. Can we talk about setting up some kind of automatic payment system so I don't have to worry about it every month?

Bot: Setting up automatic payments can definitely help you stay on top of your payments. We can set up a payment plan that suits your needs. Would you like to set up a recurring payment on the 25th of each month from your primary checking account?

User: Yeah, that sounds perfect. The 25th of each month is when I usually get paid, so it would work out great. Can you walk me through the process of setting it up?

Bot: I'd be happy to help. To set up the automatic payment, I'll just need to confirm some details with you. Can you please confirm your checking account number and the payment amount you'd like to set up?",neutral,casual
SETUP_AUTOPAY,"The bank has contacted a customer about their overdue credit card payment, which resulted from a recent medical emergency and hospitalization that led to significant expenses. Although they've since recovered and are now back on their feet, the customer expresses concern about missing another payment due to their busy schedule. To ensure they stay on top of their payments, they request to set up automatic payments on the 25th of each month from their primary checking account.","

Bot: Hi there, this is [Bank Name] calling about your credit card account. We wanted to reach out regarding your recent overdue payment.

User: Are you kidding me? I just got out of the hospital and you're calling about a payment? Can't you see I'm busy trying to get back on my feet?

Bot: I completely understand that this is a difficult time for you, and we apologize for any inconvenience this may have caused. We're here to help you get back on track. Can you tell me a bit more about what happened and why you missed the payment?

User: Look, it's not like I didn't try to pay it. I just had some unexpected medical expenses and I'm still trying to catch up. I'm not asking for a free pass, but can you at least work with me here?

Bot: We're more than happy to work with you. In fact, we have a process in place to help customers like you get back on track. One option we can explore is setting up automatic payments to ensure you never miss a payment again.

User: That's exactly what I'm asking for. Can you set up automatic payments for me? I'd like to set it up so that payments are taken on the 25th of every month from my primary checking account.

Bot: Absolutely, I can help you with that. To confirm, you'd like to set up automatic payments on the 25th of each month from your primary checking account. I'll go ahead and process that for you. Would you like to confirm your account details with me before I proceed?

User: Yeah, sure. Just make sure it's set up correctly and we're good to go.",angry,casual
SETUP_AUTOPAY,"The bank has contacted a customer about their overdue credit card payment, which resulted from a recent medical emergency and hospitalization that led to significant expenses. Although they've since recovered and are now back on their feet, the customer expresses concern about missing another payment due to their busy schedule. To ensure they stay on top of their payments, they request to set up automatic payments on the 25th of each month from their primary checking account.","

Bot: Hi there, this is [Bank Name] reaching out regarding your past-due credit card balance. We're here to help you get back on track.

User: whass good bank dude? i'm good, just super busy rn. how much do i owe?

Bot: I understand you're busy, and we're here to help. You have a balance of $500 due from last month's statement. Don't worry, we're not here to stress you out; we just want to make sure you have the support you need.

User: okay, cool. so like, what's the plan to get me outta this?

Bot: We have a few options to help you get back on track. One option is to set up automatic payments from your checking account, so you'll never miss a payment again. Would you like to explore that option?

User: yeah, that sounds dope. how do i set it up? can i do it online or something?

Bot: Absolutely, you can set it up online or give us a call. To set up automatic payments, we'll need to move the due date to the 25th of each month. That way, you'll have a steady payment plan in place. Would you like me to guide you through the online process or walk you through it over the phone?

User: yeah, that sounds good. can you just show me how to do it online?",confused,slang
SPEAK_TO_AGENT,"The bank has contacted a customer regarding a past-due mortgage payment that is now 60 days overdue. The customer explains they are going through a divorce and their ex-partner was responsible for making mortgage payments, but they recently discovered their ex-partner has stopped making payments. They want to speak directly with a human agent to discuss possible options, such as refinancing or temporarily suspending payments, to avoid foreclosure and stabilize their financial situation.","

Bot: Hi there, this is an automated representative from [Bank Name]. We're reaching out regarding a past-due balance on your mortgage account. Could you please confirm your account information so we can better assist you?

User: Hi, yeah, I think it's my mortgage account. But I need to speak with a person, not a machine. I have a bit of a situation going on and I'd like to discuss some options with someone directly.

Bot: I completely understand, and I'd be happy to help you get in touch with a representative. However, to ensure we have the right information, can you please confirm your account details with me? This will help us expedite the process.

User: I don't know if I'm comfortable sharing that over the phone. Can you tell me a bit about the options you might be able to help me with? I'm kind of in a tough spot right now.

Bot: I'd be happy to explain some possible options, but please know that I can still connect you with a representative if you'd prefer. Regarding your account, I want to assure you that we're here to help. We understand that unforeseen circumstances can arise, and we're committed to working with you to find a solution.

User: Okay, I appreciate that. To be honest, I'm going through a divorce, and my ex-partner was supposed to be making mortgage payments. But they've stopped paying altogether, and now I'm facing a huge balance. I was wondering if there's any way I could refinance or maybe temporarily suspend payments to avoid foreclosure.

Bot: I'm so sorry to hear that you're going through this. Refinancing or suspending payments might be viable options for you. However, I'd like to discuss these possibilities in more detail with a representative who can assess your specific situation. Would you like me to transfer you to someone who can further assist you?",neutral,casual
