intent,scenario,conversation_text,sentiment,user_speech_type
SCHEDULE_PAYMENT,"The customer's personal loan payment is past due after missing the March 25th installment due to a car breakdown that left them with unexpected repair costs. With their vehicle now repaired and a stable income through their part-time job, they now wish to schedule a payment of $800.50 for July 22nd using their checking account ending in 6291 to prevent further delinquency and avoid a negative mark on their credit report.","

Bot: Hi there, this is [Bank Name] calling about your personal loan account. We wanted to check in with you about the March 25th payment that's currently past due.

User: Hey, yeah I'm aware of it. I had a bit of an unexpected car breakdown and it took some time to get everything sorted out.

Bot: Sorry to hear that. We understand things can come up unexpectedly. Can you tell me a bit more about your current situation and how you plan to catch up on the payment?

User: Yeah, my car's all fixed now and I've got a steady income from my part-time job, so I'm in a better place financially. I'd like to schedule a payment of $800.50 for July 22nd using my checking account ending in 6291.

Bot: Great to hear that things are looking up. I can definitely help you set up a payment for July 22nd. Before we proceed, I just want to confirm the payment amount and date: $800.50 on July 22nd using checking account ending in 6291. Is that correct?

User: Yep, that's exactly right.

Bot: I've gone ahead and scheduled the payment for you. You should receive an email confirmation with the payment details. If you have any questions or concerns, feel free to reach out to us.

User: Alright, thanks for your help. I'll keep an eye out for the email.",neutral,casual
SCHEDULE_PAYMENT,"The customer's personal loan payment is past due after missing the March 25th installment due to a car breakdown that left them with unexpected repair costs. With their vehicle now repaired and a stable income through their part-time job, they now wish to schedule a payment of $800.50 for July 22nd using their checking account ending in 6291 to prevent further delinquency and avoid a negative mark on their credit report.","

Bot: Hi there, we noticed that your personal loan payment is past due. How can we help you get back on track?

User: wassup? got a prob wit my loan. i got hit wit some unexpected car repairs and missed a payment. now i gotta deal wit the fallout. can u help me out?

Bot: I'm happy to help, and I understand that unexpected expenses can be tough to handle. Can you tell me a bit more about your situation and what you're looking to do next?

User: yeah, i got my car fixed now, and i'm back on my feet. i wanna pay the $800.50 that i owe, but i wanna do it on my own terms. i wanna schedule a payment for july 22nd using my checking account that ends in 6291.

Bot: I'd be happy to assist you with setting up a payment. To confirm, you'd like to make a payment of $800.50 on July 22nd using your checking account ending in 6291. Is that correct?

User: yeah, that's the one. make sure it goes through on july 22nd, or i'll have a prob wit my credit score.

Bot: I've gone ahead and scheduled the payment for you. You should receive a confirmation email with the details of the payment. We'll also make sure that the payment is processed on July 22nd as you requested. Is there anything else I can help you with today?",angry,slang
SCHEDULE_PAYMENT,"The customer's personal loan payment is past due after missing the March 25th installment due to a car breakdown that left them with unexpected repair costs. With their vehicle now repaired and a stable income through their part-time job, they now wish to schedule a payment of $800.50 for July 22nd using their checking account ending in 6291 to prevent further delinquency and avoid a negative mark on their credit report.","

Bot: Hi there, this is [Bank Name] customer care. How can we assist you today?

User: wassup? i gotta pay some cash i owe u guys, but i dont know how to do it rn.

Bot: Sorry to hear you're having some issues. To make a payment, you can log into your online banking account or give us a call to speak with one of our representatives. We can also help you set up a payment over the phone if you prefer.

User: i already logged in, but i dont see the option to pay my loan. i thought it was due like a few months ago?

Bot: I'd be happy to help you find that option. Can you please check your account overview and see if there's a ""Make a Payment"" or ""Pay Now"" option available?

User: yeah, i got that part, but its not showin the date i want to pay, which is july 22nd. i wanna pay 800.50

Bot: I see. Let's see what we can do. Can you please confirm your account number and the payment amount you'd like to make, and I'll guide you through the process to schedule a payment for July 22nd?

User: my account ends in 6291, and i wanna pay 800.50. can u do it for me now?

Bot: I'd be happy to help you set that up. However, to confirm the payment, I just need to ask a few more questions. Are you sure you'd like to pay $800.50 on July 22nd from your checking account ending in 6291?

User: yep, thats right. dont wanna be late again. i got my car fixed and im back to work, so i should be good now.

Bot: That's great to hear, and thank you for taking care of your account. I've gone ahead and scheduled the payment for you. You should receive an email confirmation shortly, and your account will be updated to reflect the payment. If you have any other questions or concerns, please don't hesitate to reach out.",confused,slang
SCHEDULE_PAYMENT,"The customer's personal loan payment is past due after missing the March 25th installment due to a car breakdown that left them with unexpected repair costs. With their vehicle now repaired and a stable income through their part-time job, they now wish to schedule a payment of $800.50 for July 22nd using their checking account ending in 6291 to prevent further delinquency and avoid a negative mark on their credit report.","

Bot: Hi, this is [Bank Name] Collections calling about your personal loan. How can I assist you today?

User: wht r u callin about i dont no wut u mean

Bot: Hello, I apologize if there was any confusion. We're calling about your personal loan account that's past due. We'd like to help you get back on track with your payments.

User: ok i rememba now i had a car break down & had to pay 4 repairz

Bot: I see. Sorry to hear that you experienced a car breakdown. We're here to help you get back on schedule. Can you tell me when you think you'll be able to make your next payment?

User: i got my car fixed & im workin partime now so i think i can pay nxt week

Bot: That's great news! We're happy to hear that you're getting back on your feet. However, our system shows that the March 25th installment is still past due. Would you like to schedule a payment for that amount today?

User: ok wut do i need 2 do 2 make a paymnt

Bot: To schedule a payment, I'll need to verify your checking account information. Can you confirm the account ending in 6291 is still active and you have sufficient funds to cover the payment?

User: yea thats my acount & i have enuf funds

Bot: Great, thank you for confirming. To schedule a payment of $800.50 for July 22nd, I'll just need you to confirm the payment details. Is that correct?

User: yea thats rite

Bot: Wonderful, your payment is now scheduled for July 22nd. You should receive a confirmation email with the payment details. If you have any questions or concerns, please don't hesitate to reach out to us.",confused,typos
SCHEDULE_PAYMENT,"The customer's personal loan payment is past due after missing the March 25th installment due to a car breakdown that left them with unexpected repair costs. With their vehicle now repaired and a stable income through their part-time job, they now wish to schedule a payment of $800.50 for July 22nd using their checking account ending in 6291 to prevent further delinquency and avoid a negative mark on their credit report.","

Bot: Hi there, this is [Bank Name] reaching out about your personal loan. We noticed that your March 25th payment is past due. How can we assist you today?

User: Yeah, I just had some unexpected car repair costs that threw off my payment schedule. I've got everything sorted now and I'd like to make a payment. What's the next step?

Bot: Sorry to hear that you had some unexpected expenses. We're happy to help you get back on track. To make a payment, you'll need to choose a date and payment method. Which date would you like to make your payment, and would you prefer to pay with a checking account or another option?

User: I'd like to pay on July 22nd and I'd like to use my checking account. I think it's ending in 6291. Can I do that?

Bot: Great choice! To confirm, you'd like to make a payment of $800.50 on July 22nd using your checking account ending in 6291. Is that correct?

User: That's right. Can you just confirm that this will prevent any further delinquency on my account and won't affect my credit report?

Bot: Yes, making a payment on July 22nd will bring your account up to date and prevent any further delinquency. It will also help maintain a positive credit history. We'll process your payment as soon as it clears your account. Would you like to review and confirm your payment details before we proceed?

User: Yeah, that sounds good. I just want to make sure everything is accurate.",neutral,casual
REQUEST_EXTENSION,"A customer has a past-due credit card balance, and the bank has reached out after missing the August 15th payment. The customer explains that they recently experienced a sudden and unexpected home renovation that required an emergency repair, resulting in unexpected expenses exceeding $10,000. They are requesting an extension to move their due date from September 10th to November 15th to allow time to adjust their budget and secure a short-term loan to cover the remaining expenses.","

Bot: Hi there, this is [Bank Name] reaching out about your past-due credit card balance. We wanted to touch base and see how we can help.

User: what's going on with my account? I thought I had paid everything on time. I'm really confused right now.

Bot: Sorry to hear that you're feeling confused. It seems that your payment due date was August 15th, but we didn't receive the payment. We're here to help you get back on track. Can you tell me a bit more about what's going on with your account?

User: honestly, I don't know. I had paid it, I'm sure of it. But then something unexpected happened. We had a pipe burst in our house and we had to do an emergency repair. It's been a total nightmare, and I'm still trying to get everything sorted out.

Bot: I'm so sorry to hear that you're going through this. A pipe burst can be a big emergency. I'd be happy to help you figure out a solution. Can you tell me more about the repair and how it's affected your budget?

User: yeah, it's been really tough. We had to spend over $10,000 to fix the pipe and replace some of the damaged flooring. It's been a huge hit to our budget, and I'm still trying to get everything sorted out. I was wondering if I could maybe get an extension on my payment due date? I was thinking maybe I could move it to November 15th to give myself some more time to get everything adjusted.

Bot: I understand that this is a difficult situation, and I'm happy to help you work out a solution. Moving your due date to November 15th is definitely something we can consider. However, I do need to let you know that any late fees that have accrued will still need to be paid. Can I walk you through some options for how to proceed and get you back on track?",confused,casual
REQUEST_EXTENSION,"A customer has a past-due credit card balance, and the bank has reached out after missing the August 15th payment. The customer explains that they recently experienced a sudden and unexpected home renovation that required an emergency repair, resulting in unexpected expenses exceeding $10,000. They are requesting an extension to move their due date from September 10th to November 15th to allow time to adjust their budget and secure a short-term loan to cover the remaining expenses.","

Bot: Hello, this is [Bank Name] Collections. How can I help you today?

User: Hi, I think I might have missed the August payment on my credit card. I'm trying to get everything sorted out.

Bot: I see that the payment was due on August 15th. Can you tell me a little bit about what happened? You don't have any past-due notices on record, so I'm here to help you get back on track.

User: Yeah, I'm really sorry about that. I recently had to do some emergency repairs on my home, and it ended up costing way more than I expected. I'm talking over $10,000 in unexpected expenses. I've been trying to catch up, but it's been tough.

Bot: I'm so sorry to hear that, [Customer Name]. Home repairs can be a real challenge. Can you tell me more about your current financial situation and how you're planning to cover the remaining expenses?

User: Honestly, I'm still trying to figure that out. I need to adjust my budget a bit more, and I'm actually looking into getting a short-term loan to cover the rest. I was wondering if I could get an extension on my due date to November 15th? That would really help me get everything in order.

Bot: I understand your situation, and I'd be happy to discuss an extension with you. Can you tell me more about your current financial situation and how you plan to cover the expenses moving forward? We want to make sure you're able to get back on track without any further issues.

User: Well, like I said, I'm looking into a short-term loan. I'm also going to have to cut back on some expenses and see where I can make some adjustments. I'm hoping to get everything under control by November 15th, and that's why I was hoping to push the due date back.

Bot: I appreciate your transparency, [Customer Name]. I'm going to go ahead and discuss this with our collections team to see what we can do. Can I follow up with you in the next 24-48 hours to let you know the outcome?

User: That sounds great, thank you so much. I appreciate your help and understanding.",neutral,casual
REQUEST_EXTENSION,"A customer has a past-due credit card balance, and the bank has reached out after missing the August 15th payment. The customer explains that they recently experienced a sudden and unexpected home renovation that required an emergency repair, resulting in unexpected expenses exceeding $10,000. They are requesting an extension to move their due date from September 10th to November 15th to allow time to adjust their budget and secure a short-term loan to cover the remaining expenses.","

Bot: Hi there, this is an automated call from Bank First. We're reaching out about your past-due credit card balance. Can you please take a moment to review your account and let us know how we can assist you today?

User: Hi, yeah, I can look at it. I'm not sure what's going on. I thought my payment was due on the 15th of August, but I didn't get a chance to send it in. I'm not behind by much, right?

Bot: Actually, your payment was due on the 15th, and we haven't received it yet. Unfortunately, that means your account is now past due. Can you tell me a little bit about what happened? You mentioned you were expecting to make a payment, so I'd like to understand the situation a bit better.

User: Honestly, I had some unexpected expenses come up. I recently had to do some emergency repairs on my home, and it ended up costing way more than I anticipated – over $10,000. I was trying to get it done as quickly as possible, but I didn't have a lot of time to adjust my budget.

Bot: I'm so sorry to hear that you're going through this. Emergency repairs can be really stressful and unexpected. We're here to help, and I'd like to discuss some options with you. Have you considered reaching out to a credit card hardship program or a short-term loan to help cover the remaining expenses?

User: Yeah, I'm actually looking into that right now. But I was wondering if there's any way to extend my due date a bit. I'd like to move it from the 10th of September to the 15th of November, just to give myself some extra time to get everything sorted out.

Bot: I can definitely look into that for you. Let me check on a few things, and I'll see what we can do. Can you hold for just a moment?

Bot: Hi again, I've checked on the extension for you, and I'm happy to let you know that we can move your due date to the 15th of November. This will give you some extra time to adjust your budget and secure a short-term loan, as you mentioned. Is that something you'd like to proceed with?

User: Yeah, that sounds great. Thank you so much for your help. I really appreciate it.

Bot: You're welcome, and I'm happy to help. Just to confirm, I've updated your account to reflect the new due date of November 15th. If you have any further questions or concerns, please don't hesitate to reach out. We're here to support you.",neutral,casual
REQUEST_EXTENSION,"A customer has a past-due credit card balance, and the bank has reached out after missing the August 15th payment. The customer explains that they recently experienced a sudden and unexpected home renovation that required an emergency repair, resulting in unexpected expenses exceeding $10,000. They are requesting an extension to move their due date from September 10th to November 15th to allow time to adjust their budget and secure a short-term loan to cover the remaining expenses.","

Bot: Hi, this is a representative from Bank of America. We wanted to reach out regarding your past-due balance on your credit card. Can you please confirm your account information so we can better assist you?

User: oh no dont wory bout my accnt info i can provd it if need it. i just need some help with this past due thingy

Bot: Thank you for being proactive. It sounds like you're going through a bit of a challenging time. Can you tell me a bit more about what's going on and how this past-due balance occurred?

User: well i recently had to do some emergncy repairs on my home. a pipe burst and damged my ceeling and walls. i didnt have enuf time to get a loan or somethin so i had to put it on my credit card. i just found out the repairs cost way more than i expected so now i owe like 10k

Bot: I'm so sorry to hear that you're going through this. It sounds like an unexpected and stressful situation. How are you planning to cover the remaining expenses, now that you have a better estimate of the costs?

User: i think i can get a short term loan or somethin. but i need some more time to sort out my budget and get the funds in place. can i plesase request an extention on my due date from sept 10th to nov 15th?",neutral,typos
REQUEST_EXTENSION,"A customer has a past-due credit card balance, and the bank has reached out after missing the August 15th payment. The customer explains that they recently experienced a sudden and unexpected home renovation that required an emergency repair, resulting in unexpected expenses exceeding $10,000. They are requesting an extension to move their due date from September 10th to November 15th to allow time to adjust their budget and secure a short-term loan to cover the remaining expenses.","

Bot: Hi there, this is [Bank Name] Collections. I'm reaching out regarding your past-due credit card balance. I wanted to touch base with you to discuss the best way to move forward.

User: oh no i cnt belive i missed the august 15th paymnt. i hav been having som issues at hom. we had a sudden renvation that required an emergancy repair. i didnt expect it to cost so much, over 10k!!

Bot: I'm so sorry to hear that you're going through this, Emily. Unexpected expenses can be really tough to handle. Can you tell me a bit more about the situation and how you think we can work together to get your account back on track?

User: well i was in the middl of a renvation and the roof started leaking somwhere. we had to get a temparary fix or our whole house would have flooded. then we discovered that the whole roof needed to be replacd. it wasnt somthing i could have seen comin. i just need a littl more time to get my finaces in order.

Bot: I understand the situation is a bit more complex than we initially thought, Emily. We want to help you get back on track, but we also need to ensure that we're taking care of your account. Can you tell me a bit more about your proposed plan to move your due date from September 10th to November 15th? How do you plan to adjust your budget and secure a short-term loan to cover the remaining expenses?",neutral,typos
SEND_STATEMENT_COPY,"The bank has reached out to a customer about a past-due balance on their Checking Account 1234, which has been delinquent for six months. The customer explains that they recently experienced a home burglary and had to pay for emergency repairs, which left them short on funds. They are now trying to understand the full extent of their overdue balance, including accrued interest and late fees, but cannot locate their most recent statement. To accurately assess their situation and begin resolving the debt, they request a copy of their August 2025 Checking Account 1234 statement.","

Bot: Hi there, this is an automated call from [Bank Name]. We wanted to follow up on your Checking Account 1234, which has been past due for six months. How are you today?

User: Good morning. I appreciate the call. I've been expecting to hear from someone about this account. I've been trying to get everything sorted out.

Bot: I understand that this can be a stressful situation. We're here to help. Can you tell me a little bit about what's been going on with your account? You mentioned you were expecting a call, so I'd like to confirm that we have the correct information.

User: Yes, I'd be happy to explain. Unfortunately, I recently experienced a home burglary, and I had to pay for some emergency repairs. This left me short on funds, and I fell behind on my account payments. I've been working to get everything back on track, but I've been having trouble locating my most recent statement.

Bot: I'm so sorry to hear about the burglary, and I'm glad you're taking steps to get back on track. We're here to support you. Can you confirm your account number, so I can look into this further for you?

User: My account number is Checking Account 1234. However, I'd like to clarify that I'm not looking for any account information beyond my statement. I just need a copy of my August 2025 statement to understand the full extent of my overdue balance, including any accrued interest and late fees.

Bot: I've gone ahead and requested a copy of your August 2025 statement for you. It will be emailed to you within the next 24 to 48 hours. In the meantime, I can provide you with an estimate of your current balance, including any accrued interest and late fees. Would you like me to do that for you?

User: Yes, that would be very helpful. I appreciate your assistance with this matter.",neutral,professional
SEND_STATEMENT_COPY,"The bank has reached out to a customer about a past-due balance on their Checking Account 1234, which has been delinquent for six months. The customer explains that they recently experienced a home burglary and had to pay for emergency repairs, which left them short on funds. They are now trying to understand the full extent of their overdue balance, including accrued interest and late fees, but cannot locate their most recent statement. To accurately assess their situation and begin resolving the debt, they request a copy of their August 2025 Checking Account 1234 statement.","

Bot: Hello, this is [Bank Name] Collections. I'm calling about your Checking Account 1234. Can you please confirm your account information so I can assist you with your past-due balance?

User: Yeah, my name is John and my account number is 1234. I'm pretty sure that's correct.

Bot: Thank you, Mr. John. I've located your account. I wanted to discuss your outstanding balance with you. Can you tell me a little bit about what's been going on with your account recently?

User: Honestly, I've been dealing with some unexpected expenses. I recently had my home broken into, and I had to pay for some emergency repairs. I think that's where the issue started, but I'm still trying to get everything sorted out.

Bot: I'm so sorry to hear that, Mr. John. That can be really stressful. I'd be happy to help you work through this. Can you tell me more about what you're trying to do right now? Are you looking for information about your account or trying to make a payment?

User: I'm actually trying to get a better understanding of my situation. I'm not sure what my current balance is, including any interest or fees that have accrued. I'm also missing my most recent statement, which I think is from August 2025. Could I get a copy of that statement, please?

Bot: I'd be happy to help you with that, Mr. John. I can certainly provide you with a copy of your August 2025 statement. I'll go ahead and send that over to you. Would you like to receive it via email or would you prefer a physical copy?

User: Email would be great, thank you. I'd also appreciate any information you can provide about the interest and fees associated with my account. That would really help me get a clear picture of where I stand.",neutral,casual
