intent,scenario,conversation_text,sentiment,user_speech_type
PAY_NOW,"A customer's car loan payment is past due after they recently experienced a car breakdown, requiring an unexpected repair. The bank reaches out to notify them about the missed payment. The customer states they'd like to pay the full past-due amount of $2,019.50 immediately using their checking account ending in 1195.","

Bot: Hello, this is [Bank Name] calling about your car loan account. How are you today?

User: I'm doing alright, I guess. I just got my car back after it was in the shop for a while.

Bot: I'm glad to hear that your car is back with you. We noticed that there was a missed payment on your account. Can you tell me a little bit about what happened?

User: Yeah, I had to get an unexpected repair done, so my payment got missed. But I'd like to pay the full amount now.

Bot: I understand that unexpected expenses can be tough to handle. We'd be happy to help you get your account current. The amount you're past due is $2,019.50. Would you like to make a payment over the phone or would you prefer to pay online?

User: I'd rather pay online, if that's okay. I'll just use my checking account to make the payment.

Bot: That's fine. To make an online payment, you'll need to go to our website and log in to your account. Once you're logged in, you can click on the 'Make a Payment' tab and enter the amount you want to pay. In this case, you'll want to enter $2,019.50. Can you confirm that's the correct amount you'd like to pay?

User: Yeah, that's right. $2,019.50 is the amount I want to pay.

Bot: Great. Once you've entered the amount, you can select your checking account ending in 1195 as the payment method. If you have any issues or questions, you can always contact us for assistance. We're here to help.

User: Sounds good, thanks. I'll go pay it now.

Bot: You're welcome. We appreciate your prompt payment and for taking care of your account. If you have any other questions or need further assistance, please don't hesitate to reach out.",neutral,casual
PAY_NOW,"A customer's car loan payment is past due after they recently experienced a car breakdown, requiring an unexpected repair. The bank reaches out to notify them about the missed payment. The customer states they'd like to pay the full past-due amount of $2,019.50 immediately using their checking account ending in 1195.","

Bot: Hi there, this is [Bank Name] calling about your car loan account. We wanted to reach out because we noticed your last payment was missed.

User: oh no, i cant rememba why i missed it. was i supposed to pay online or somethin?

Bot: Don't worry, we're here to help. It's not uncommon for things to slip through the cracks. Can you tell me a little bit about what happened? Did you experience any issues with your account or payment method?

User: yeah, my car broke down and i had to pay for the repair. i wasnt exspecting it and it came outta my emrgency fund.

Bot: I'm so sorry to hear that. That can be a stressful situation. We understand that sometimes unexpected expenses can arise. Can you tell me how you'd like to proceed with paying the past-due amount of $2,019.50?

User: i wanna pay it all now. can i do it thru my checking account? my account ends in 1195.

Bot: Absolutely, we can definitely help you with that. To confirm, you'd like to pay the past-due amount of $2,019.50 from your checking account ending in 1195. Is that correct?

User: yeah thats right. what do i need to do next?

Bot: Great, I've gone ahead and processed the payment. You should see the funds deducted from your account within the next 24-48 hours. Once the payment is processed, we'll remove the late fee and get your account back on track.

User: awsome, thank you so much for your help.",neutral,typos
PAY_NOW,"A customer's car loan payment is past due after they recently experienced a car breakdown, requiring an unexpected repair. The bank reaches out to notify them about the missed payment. The customer states they'd like to pay the full past-due amount of $2,019.50 immediately using their checking account ending in 1195.","

Bot: Hi there, this is [Bank Name] calling about your car loan account. We wanted to reach out to you about a missed payment that was due on June 1st.

User: oh, hi... yeah, i'm aware of it. i just had some major car troubles and had to get it fixed. i'm still trying to figure out how i'm gonna pay the whole thing off.

Bot: I'm so sorry to hear that you're going through this, and we're happy to help. The total amount due is $2,019.50. We understand that this can be a stressful situation, but we're here to assist you.

User: yeah, i know. that's why i wanna pay it all off right now. can i just pay the whole thing from my checking account, the one that ends in 1195?

Bot: I'd be happy to help you with that. To confirm, you'd like to pay the full past-due amount of $2,019.50 from your checking account ending in 1195, correct?

User: yeah, that's what i said. just make sure it goes on my car loan and not anywhere else.

Bot: I've gone ahead and processed the payment for you. The funds should be deducted from your checking account ending in 1195 and applied to your car loan account immediately. You'll receive a confirmation email with the details. Is there anything else I can help you with today?",confused,casual
PAY_NOW,"A customer's car loan payment is past due after they recently experienced a car breakdown, requiring an unexpected repair. The bank reaches out to notify them about the missed payment. The customer states they'd like to pay the full past-due amount of $2,019.50 immediately using their checking account ending in 1195.","

Bot: Hello, this is [Bank Name] calling. We're reaching out to discuss your recent car loan payment. Can you please confirm your name and account information so we can better assist you?

User: Good morning. My name is John Doe. I'd be happy to confirm my information. My checking account is linked to this loan, and the account number ends in 1195.

Bot: Thank you, Mr. Doe. We have your account information on file. It appears that your payment is past due. Can you please tell us a little bit about what's going on? We understand that sometimes unexpected expenses can arise, and we're here to help.

User: Yes, I recently had my car break down, and the repair was more extensive than I anticipated. Unfortunately, I missed the payment. I'm eager to catch up on the past-due amount.

Bot: I understand, Mr. Doe. We're happy to work with you to get your account back on track. Can you please confirm the amount you're looking to pay today? According to our records, the past-due balance is $2,019.50.

User: Yes, that's correct. I'd like to pay the full amount of $2,019.50 immediately using my checking account. Can you let me know what the next steps are?

Bot: That sounds great, Mr. Doe. We can process the payment right away. I'll just need you to confirm your routing number and account number ending in 1195 to ensure the payment goes through smoothly.",neutral,professional
PAY_NOW,"A customer's car loan payment is past due after they recently experienced a car breakdown, requiring an unexpected repair. The bank reaches out to notify them about the missed payment. The customer states they'd like to pay the full past-due amount of $2,019.50 immediately using their checking account ending in 1195.","

Bot: Hi, this is [Bank Name] calling about your car loan account. We wanted to reach out regarding a past-due balance of $2,019.50. Can you please tell me a little bit about what's going on with your payment?

User: whassup? yeah i had a car breakdown recently and had to get it fixed. my payment got pushed back a lil. now i'm good tho.

Bot: Sorry to hear about the car issue. We understand that sometimes unexpected expenses can come up. We're here to help you get back on track. Can you tell me a bit more about your plan to pay the past-due balance?

User: i'm good, i just wanna pay it all off right now, like, the full $2,019.50. can i do that using my checking account that's ending in 1195?

Bot: That sounds like a great plan! Yes, you can definitely pay the full amount using your checking account. We'll just need to verify the account details with you. Can you confirm the account number for me?

User: my account's ending in 1195, that's all i got. can u just take the payment from that one?

Bot: Okay, I've got the account details on file. I'm going to go ahead and process the payment for you. This should clear the past-due balance and get you back on schedule. Would you like to make any payments for the upcoming months as well?

User: nah, just take care of the past due and we're good.",neutral,slang
SETUP_AUTOPAY,"The bank has reached out to a customer regarding a past-due credit card payment, which was missed due to a temporary delay in receiving their monthly paycheck. The customer explains that their usual payment method was tied to their employer’s direct deposit schedule, and without it, they were unable to make the payment on time. To avoid future issues, they request to set up automatic payments on the 1st of each month from their primary checking account, which they confirm has sufficient funds to cover the recurring amount.","

Bot: Hello, this is [Bank Name] calling about your credit card account. We've noticed that the recent payment was missed and we're reaching out to discuss a possible solution.

User: oH no, i'm so sorry about that! i had a tempory delay in gettin my paycheck and i forgot to pay the bill

Bot: Don't worry, we understand that sometimes unexpected delays can happen. Can you tell me a little bit more about what happened with your payment? Was there a specific issue with your usual payment method?

User: yeah, i get direct deposit from my job, but this month it was delayed. i usually tie my payments to when the deposit hits my account, but this time it didnt go thru till like 3 days late

Bot: I see. So, it sounds like the timing issue caused a delay in your payment. We appreciate your honesty and would like to help you set up a solution to avoid this in the future. Would you like to set up automatic payments for your credit card?

User: yeah, that would be great! can i set it up to pay on the 1st of every month from my primary checking account?

Bot: That's a great plan. We'll set up the automatic payment to come out of your primary checking account on the 1st of each month. Can you confirm that you have sufficient funds in your account to cover the recurring payment amount?

User: yep, i've got plenty of funds in my account. i just want to make sure i dont miss another payment

Bot: Wonderful. We'll make sure to set up the automatic payment for you. You should receive a confirmation email with the details of the new payment arrangement. If you have any questions or concerns, feel free to reach out to us. Thank you for your cooperation.",neutral,typos
SETUP_AUTOPAY,"The bank has reached out to a customer regarding a past-due credit card payment, which was missed due to a temporary delay in receiving their monthly paycheck. The customer explains that their usual payment method was tied to their employer’s direct deposit schedule, and without it, they were unable to make the payment on time. To avoid future issues, they request to set up automatic payments on the 1st of each month from their primary checking account, which they confirm has sufficient funds to cover the recurring amount.","

Bot: Hi there, this is an automated message from your bank. We wanted to reach out to you regarding a past-due credit card payment. Can you please let us know if you've experienced any issues making your payment this month?

User: yeah, i'm so sorry about that. i just got my paycheck a bit late and my payments are tied to my employer's direct deposit schedule. it's usually always on time but this month was a mess. what's the next step here?

Bot: We understand that sometimes things don't go as planned. Not to worry, we're here to help. To avoid any future issues, we'd like to discuss setting up a payment plan with you. Would you prefer to make a one-time payment or set up automatic payments?

User: actually, i'd rather set up automatic payments. can we do that? my primary checking account has more than enough to cover the recurring amount. i just want to make sure everything is squared away.

Bot: Setting up automatic payments is a great idea. To make sure everything goes smoothly, can you please confirm that you'd like to set up a recurring payment on the 1st of each month from your primary checking account?",confused,casual
SETUP_AUTOPAY,"The bank has reached out to a customer regarding a past-due credit card payment, which was missed due to a temporary delay in receiving their monthly paycheck. The customer explains that their usual payment method was tied to their employer’s direct deposit schedule, and without it, they were unable to make the payment on time. To avoid future issues, they request to set up automatic payments on the 1st of each month from their primary checking account, which they confirm has sufficient funds to cover the recurring amount.","

Bot: Hi there, this is [Bank Name] calling about your credit card account. We wanted to touch base with you about a past-due payment that was due on the 15th. Can you please tell me a little bit about what happened?

User: Yo, what's good? Yeah, I got your message. I'm good, just a lil' behind on the payment. I usually get my paycheck on the 15th, but this month it was a lil' delayed, so I didn't get paid till the 20th. I was all set to pay, but my card got declined 'cause it was tied to my paycheck schedule.

Bot: I understand what happened. We appreciate you reaching out to us about the issue. To avoid any future delays, we can definitely help you set up a payment plan. Can you tell me a little bit about your preferred payment method and schedule?

User: Yeah, that'd be dope. I wanna set up automatic payments, so I don't miss any payments again. I've got a primary checking account that's always got enough funds. Can we set it up to pull from that account on the 1st of each month? That way, I'll be all good.

Bot: That sounds like a great plan! I can definitely help you set that up. Just to confirm, you'd like to set up automatic payments from your primary checking account on the 1st of each month. Is that correct?

User: Exactly, yeah. That's what I'm thinkin'. Can you just make sure it's all good, so I don't have to worry about it?

Bot: Of course, I'd be happy to help. I just need to confirm a few more details with you. Can you please confirm your account information and the amount you'd like to pay each month?",neutral,slang
SETUP_AUTOPAY,"The bank has reached out to a customer regarding a past-due credit card payment, which was missed due to a temporary delay in receiving their monthly paycheck. The customer explains that their usual payment method was tied to their employer’s direct deposit schedule, and without it, they were unable to make the payment on time. To avoid future issues, they request to set up automatic payments on the 1st of each month from their primary checking account, which they confirm has sufficient funds to cover the recurring amount.","

Bot: Hello, this is [Bank Name] Collections. We're reaching out regarding your credit card account, which is currently past due. Can you please confirm your account information to verify this is you?

User: Good morning, thank you for reaching out. Yes, this is my account, and I apologize for the missed payment. I had a temporary delay in receiving my monthly paycheck, which caused the issue.

Bot: We understand that unexpected delays can happen. Can you tell me a bit more about what caused the delay in receiving your paycheck? Was there an issue with your employer's direct deposit schedule?

User: Actually, it was an issue with my usual payment method. My employer's direct deposit schedule was delayed, and as a result, my primary account wasn't credited until a week later than usual. I've since received my payment, and I'm looking to set up a payment plan to avoid any further issues.

Bot: I see. We want to make sure you're able to make your payments on time. To set up an automatic payment plan, can you please confirm your primary checking account information, including the account number and routing number?

User: Actually, I was thinking it would be easier to set up automatic payments directly from my primary checking account, rather than setting up a payment plan. Would it be possible to do that? I've confirmed that my checking account has sufficient funds to cover the recurring amount.

Bot: Absolutely, we can set up automatic payments for you. What date would you like the payments to be deducted from your checking account each month? Would you like it to be on the same date every month, or would you prefer a specific date?

User: The 1st of each month would be ideal for me. That way, I'll ensure I have enough funds in my account to cover the payment.",neutral,professional
SETUP_AUTOPAY,"The bank has reached out to a customer regarding a past-due credit card payment, which was missed due to a temporary delay in receiving their monthly paycheck. The customer explains that their usual payment method was tied to their employer’s direct deposit schedule, and without it, they were unable to make the payment on time. To avoid future issues, they request to set up automatic payments on the 1st of each month from their primary checking account, which they confirm has sufficient funds to cover the recurring amount.","

Bot: Hi there, this is [Bank Name] Collections. We're reaching out about a past-due balance on your credit card account. Can you please tell me a little bit about what happened?

User: Are you kidding me? You're calling me about this now? I just got paid yesterday and I was still waiting for my paycheck like everyone else in my situation. The bank was supposed to send the money on the 1st, but it got delayed and I got the payment on the 15th. It's not my fault.

Bot: I understand that the timing of your direct deposit can be unpredictable, and I apologize for any inconvenience this may have caused. We want to work with you to get your account back on track. To prevent this from happening again, would you like to set up automatic payments for your credit card bill?

User: Yeah, that sounds like a good idea. I just want to make sure I'm not getting hit with late fees and penalties. Can you set it up so it takes the payment from my primary checking account on the 1st of every month? That way, I'll know exactly when it's going to come out.

Bot: I can definitely do that for you. I just need to confirm that your checking account has sufficient funds to cover the recurring payment amount. Can you please verify that with me?

User: Yeah, I've got more than enough in my checking account to cover the payment. I'll make sure to keep it that way. Just set it up and let's get this straightened out.",angry,casual
REQUEST_PAYMENT_PLAN,"The bank has contacted a customer about a past-due balance on their personal line of credit after missing three monthly payments due to an unexpected tax audit, which required additional funds for a settlement. Although the customer has since resolved the tax issue and resumed making regular payments, they are still unable to pay the full overdue amount. To avoid further fees and protect their credit history, they request a payment plan to repay the outstanding balance in seven monthly installments using their primary checking account, which they can manage consistently with their new income.","

Bot: Hello, this is a representative from [Bank Name]. We're calling about your personal line of credit account. We noticed that you've missed three monthly payments. Can you please confirm your name and account information so we can discuss this further?

User: Good morning, yes, this is John Smith speaking. I'm happy to discuss my account with you. I can confirm my account information is up to date.

Bot: Thank you, Mr. Smith. I see that you're currently past due on your payments. Can you tell me a little bit about what happened? We've noticed that you've had some larger-than-usual payments recently, and we're concerned that you may be experiencing some financial difficulties.

User: Yes, I did have an unexpected tax audit, which required additional funds for a settlement. I've since resolved the issue, and my regular payments have resumed. However, I'm still struggling to pay the full amount that's overdue.

Bot: I understand that tax audits can be costly and unexpected. We're glad to hear that you've resolved the issue. In that case, we'd like to work with you to find a solution that fits your current financial situation. Have you had a chance to review our payment plan options, or would you like us to explain them to you now?

User: I would appreciate it if you could explain the payment plan options to me. I'm interested in finding a solution that will allow me to repay the outstanding balance in a manageable way.

Bot: We have a few options available to you. We can set up a payment plan that allows you to make monthly payments over a period of time. In this case, we would need to ensure that you have a steady income and a checking account that you can use for payments. Would you like to discuss the specifics of a seven-month payment plan, as you mentioned earlier?

User: Yes, that's exactly what I was thinking. A seven-month payment plan would be ideal for me, as I'll have a consistent income and can manage payments from my primary checking account.

Bot: That sounds like a good plan. Let's go ahead and set up a payment plan for you. We'll need to confirm the details, but it seems that we can work out a payment schedule that suits your needs. Is there anything else you'd like to discuss or any questions you have before we move forward?

User: No, I think that's all for now. Thank you for your understanding and assistance. I appreciate your help in finding a solution that works for me.

Bot: You're welcome, Mr. Smith. We're happy to help. We'll send you a confirmation of the payment plan details via email, and you can also track your payments online. If you have any questions or concerns, please don't hesitate to reach out to us.",neutral,professional
REQUEST_PAYMENT_PLAN,"The bank has contacted a customer about a past-due balance on their personal line of credit after missing three monthly payments due to an unexpected tax audit, which required additional funds for a settlement. Although the customer has since resolved the tax issue and resumed making regular payments, they are still unable to pay the full overdue amount. To avoid further fees and protect their credit history, they request a payment plan to repay the outstanding balance in seven monthly installments using their primary checking account, which they can manage consistently with their new income.","

Bot: Hi there, this is [Bank Name] calling about your personal line of credit. We wanted to touch base with you about your recent payments. Can you tell me a little bit about what's going on?

User: Yeah, hi. I know I've missed a few payments, but I've got everything sorted out now. I had a tax audit and had to pay a settlement, but it's all taken care of. I've been making regular payments again.

Bot: I'm glad to hear that everything's resolved, and you're back on track with your payments. However, we do have an outstanding balance that we'd like to discuss with you. Can you estimate when you might be able to pay the full amount?

User: To be honest, I'm still a bit short. I've got a good income now, but it'll take me a few months to get back on top of everything. Can I set up a payment plan or something?

Bot: Absolutely, we can definitely work with you to set up a payment plan. Our goal is to help you get back on track and avoid any further fees. Can you tell me a bit more about your current income and expenses? We can use that information to determine a realistic payment plan for you.

User: Yeah, sure. I've got a regular income now, and I've been able to get my expenses under control. I think I can manage seven monthly payments without any issues. I'd like to use my primary checking account for the payments, if that's okay.

Bot: That sounds like a great plan. We can set up a payment plan with seven monthly payments using your primary checking account. I'll go ahead and process that for you. Can you confirm that you're comfortable with the plan and the payment amount?

User: Yeah, that sounds perfect. I just want to make sure I can get back on track and avoid any more fees.",neutral,casual
