intent,scenario,conversation_text,sentiment,user_speech_type
SPEAK_TO_AGENT,"The bank has contacted a customer about a past-due auto loan payment that is now 90 days overdue, with a total amount of $4,200. The customer is experiencing financial difficulties due to a recent divorce, resulting in a significant reduction of their income. They are trying to make ends meet but are struggling to keep up with their loan payments. They request to speak with a human agent to discuss their account status, explore possible hardship accommodations, and determine the best course of action for their situation.","

Bot: Hello, this is an automated representative from [Bank Name]. We're calling to discuss your auto loan account with us. Your account is currently past due by $4,200, and we wanted to check in to see how you're doing.

User: Thank you for reaching out. I appreciate your concern. I'm currently going through a bit of a difficult time personally, and I'm having some trouble keeping up with my loan payments.

Bot: I'm so sorry to hear that you're going through a tough time. We're here to help, and I'd be happy to connect you with one of our experienced loan specialists who can review your account and discuss possible hardship accommodations. Can you please confirm your name and account information so I can assist you further?

User: My name is [Customer Name], and I'd like to speak with a loan specialist as soon as possible. I'm having a hard time making ends meet due to recent financial changes in my life, and I was hoping we could discuss some options for my account.

Bot: I understand that this is a challenging situation, and we want to work with you to find a solution. I'm going to transfer you to our loan specialist department, where they will be able to review your account and discuss possible hardship accommodations with you. Please hold for just a moment while I complete the transfer.

User: Thank you, I appreciate your help. I'm looking forward to speaking with someone who can assist me with my account.

Bot: You're welcome, [Customer Name]. One of our loan specialists will be with you shortly to discuss your account and explore possible solutions.",neutral,professional
CREDIT_SCORE_QUERY,"The bank has reached out to a customer about a 90-day overdue personal loan payment due to a medical emergency that left them with significant expenses. The customer, a retiree living on a fixed income, is worried about how this delinquency will impact their credit score, especially since they're planning to apply for a reverse mortgage in the next year to supplement their retirement income. They are seeking information on whether the late payment has already been reported to credit bureaus and what steps they can take to mitigate long-term damage.","

Bot: Hello, this is [Bank Representative]. We're reaching out about your personal loan account. Could you please confirm your name?

User: hi ths is johndoe. wats goin on with my loan?

Bot: Good morning, Mr. Doe. I'm happy to help. We've noticed that your recent payment was 90 days past due. I'd like to offer our support in getting your account back on track. Can you tell me a bit about what's been going on and what you're expecting from us?

User: yeah, i had a med emergency last year and things got pretty expensiv. i havent had a chance to catch up yet. whos this btw?

Bot: I understand, Mr. Doe. Sorry to hear that you're going through a tough time. My name is Emily, and I'm a representative from our collections team. We're here to help you navigate this situation. Can you tell me more about your income situation now that the medical expenses have been covered? We want to make sure we're offering the right support to get you back on track.

User: i live off a fixed income, so its been tough to make ends meet. i was plannin on gettin a revrs mortgage in the next yr or so to help out. will this late payement hurt my credit score?

Bot: I understand your concern, Mr. Doe. I'm happy to let you know that we've not yet reported this late payment to the credit bureaus. We're working with you to get your account current, and we're willing to consider the impact of this situation on your credit score. In fact, we're offering a temporary hold on reporting this late payment to the credit bureaus while we work together to get your account back on track. Can you tell me more about your plans for the reverse mortgage and how it will fit into your overall financial picture?

User: thats great news, emily. i dont want any more hiccups in my credit score. whats the next step here?

Bot: That's good to hear, Mr. Doe. The next step is for us to work together to set up a payment plan that fits your budget. We can discuss some options for how to make regular payments and get your account current. Would you be available to set up a call with one of our financial advisors to discuss the details?

User: yeah, thats sounds good. wwhen can we schedul this?

Bot: Let's schedule the call for tomorrow afternoon. I'll send you a confirmation email with the details. In the meantime, I'll send you a payment plan form to review and complete. Can you please let me know if you have any questions or concerns before the call?",neutral,typos
CREDIT_SCORE_QUERY,"The bank has reached out to a customer about a 90-day overdue personal loan payment due to a medical emergency that left them with significant expenses. The customer, a retiree living on a fixed income, is worried about how this delinquency will impact their credit score, especially since they're planning to apply for a reverse mortgage in the next year to supplement their retirement income. They are seeking information on whether the late payment has already been reported to credit bureaus and what steps they can take to mitigate long-term damage.","

Bot: Hi there, this is an automated call from [Bank Name]. We're reaching out to discuss your recent loan payment that's 90 days past due. How are you today?

User: im doin ok thank u for askin whats goin on with my loan tho i wasnt aware it was that late

Bot: I apologize for the delay in communication. We understand that life can be unpredictable, and we're here to help. Can you tell me a little bit about what's been going on that's caused the delay in your payment?

User: yeah i had a pretty bad medical expence that put me in a tough spot financially havent had the chance to get back on my feet yet

Bot: I'm so sorry to hear that. We want to support you during this challenging time. In terms of your loan, I want to reassure you that we're working with you to find a solution. However, I do want to discuss the potential impact on your credit score. Have you been concerned about how this late payment might affect your credit?

User: yea thats actually my biggest worry right now im planning on applying for a reverse mortage in the next yr and i dont want this delinquency to hurt my chances

Bot: I understand your concern. We want to be transparent with you about our reporting procedures. As of now, the late payment has been reported to the credit bureaus. However, we're willing to work with you to minimize the long-term impact. Can you tell me more about your plans for getting back on track with your loan payments?

User: i was thinking maybe we could set up a payment plan or somethin? idk if thats somethin you guys would be able to do tho

Bot: We can definitely discuss a payment plan with you. I'll go ahead and review our options, and I'll be in touch with you shortly to discuss the details. In the meantime, I want to encourage you to reach out to our customer service team if you have any questions or concerns. They're here to support you every step of the way.",neutral,typos
CREDIT_SCORE_QUERY,"The bank has reached out to a customer about a 90-day overdue personal loan payment due to a medical emergency that left them with significant expenses. The customer, a retiree living on a fixed income, is worried about how this delinquency will impact their credit score, especially since they're planning to apply for a reverse mortgage in the next year to supplement their retirement income. They are seeking information on whether the late payment has already been reported to credit bureaus and what steps they can take to mitigate long-term damage.","

Bot: Hello, this is [Bank Representative] from [Bank Name]. I'm calling to discuss the status of your personal loan account. I understand you have a question about a recent payment.

User: I've received multiple calls from your bank about a delinquent payment on my personal loan. I'm a retiree living on a fixed income, and this medical emergency has left me with significant expenses. I'm worried about the impact this will have on my credit score.

Bot: I apologize for any inconvenience this has caused, and I'm happy to help. I'd like to confirm that you did have a payment due on your personal loan, and it is indeed 90 days past due. However, I want to assure you that we're here to work with you to find a solution.

User: The issue is, I'm planning to apply for a reverse mortgage in the next year, and I'm concerned that this late payment will hurt my chances. Can you tell me if the late payment has already been reported to credit bureaus?

Bot: I'd be happy to look into that for you. Unfortunately, due to the nature of our payment reporting, it's possible that the late payment may have been reported to the credit bureaus. However, I can provide you with information on how to dispute any potential errors and take steps to mitigate the impact on your credit score.

User: Can you please provide me with the specific steps I can take to dispute any errors and minimize the damage? I want to make sure I'm taking the right actions to protect my credit score.

Bot: I'd be happy to walk you through the process. First, I recommend that you obtain a copy of your credit report from the three major credit bureaus and review it for any errors. You can request a free copy of your report from AnnualCreditReport.com. Once you've obtained your report, review it carefully and dispute any errors you find. We can also provide you with a letter confirming that the late payment was due to a medical emergency, which you can include with your dispute.

User: Thank you for your help and guidance. I appreciate your understanding and willingness to work with me to resolve this issue.",angry,professional
CREDIT_SCORE_QUERY,"The bank has reached out to a customer about a 90-day overdue personal loan payment due to a medical emergency that left them with significant expenses. The customer, a retiree living on a fixed income, is worried about how this delinquency will impact their credit score, especially since they're planning to apply for a reverse mortgage in the next year to supplement their retirement income. They are seeking information on whether the late payment has already been reported to credit bureaus and what steps they can take to mitigate long-term damage.","

Bot: Hello, this is a representative from your bank. We wanted to follow up on your recent loan payment that's currently past due. Can you please confirm your name so we can look into this matter further?

User: Hello, my name is John. I apologize for the delay on my payment. Unfortunately, I've been dealing with some significant medical expenses and it's been a challenge to make ends meet on my fixed income. I'm worried about how this will affect my credit score, especially since I'm planning to apply for a reverse mortgage in the next year.

Bot: I understand your concern, John. We're here to help. I want to assure you that we're not looking to penalize you for your situation. However, I do need to let you know that we do report payment information to the credit bureaus. As for whether the late payment has already been reported, it typically takes 30 to 60 days for the information to be reflected in your credit report.

User: Okay, that's helpful to know. But what can I do to mitigate the long-term damage to my credit score? I'm trying to be proactive and ensure that this delinquency doesn't have a lasting impact on my credit.

Bot: We can definitely work with you to minimize the damage. I'd like to offer a payment arrangement that will help bring your account up to date. This will also help prevent further negative reporting to the credit bureaus. Would you be interested in discussing some options for bringing your account current?

User: Yes, I'd like to hear more about that. Can you walk me through the process and what I can expect? I want to make sure I understand what's involved and how this will affect my credit score in the long run.",confused,professional
CREDIT_SCORE_QUERY,"The bank has reached out to a customer about a 90-day overdue personal loan payment due to a medical emergency that left them with significant expenses. The customer, a retiree living on a fixed income, is worried about how this delinquency will impact their credit score, especially since they're planning to apply for a reverse mortgage in the next year to supplement their retirement income. They are seeking information on whether the late payment has already been reported to credit bureaus and what steps they can take to mitigate long-term damage.","

Bot: Hi there, this is [Bank Name] calling about your personal loan account. I wanted to reach out to discuss the 90-day overdue payment. Can you tell me a little bit about what's been going on?

User: Yeah, I'm a bit behind on payments. To be honest, I've been dealing with some pretty significant medical expenses lately. I'm on a fixed income, so it's been tough to keep up.

Bot: I'm so sorry to hear that. We're here to help. Can you tell me a bit more about your current financial situation and what you're expecting for your income in the coming months?

User: Well, my expenses are pretty much set in stone, and it's just a matter of making do with what I have. I'm actually planning to apply for a reverse mortgage in the next year to help supplement my income. But I'm worried about this delinquency affecting my credit score.

Bot: I understand your concern. Let me check on that for you. (pause) Okay, it looks like the delinquency has indeed been reported to the credit bureaus. However, we can work with you to get your account current and help mitigate any potential damage to your credit score.

User: Okay, that's good to know. What can I do to get my account current, and what steps can I take to minimize the impact on my credit score?

Bot: We can set up a payment plan that works for you. I can also provide you with some information on how to dispute any negative marks on your credit report if needed. Would you like me to send you some information on that?",neutral,casual
REQUEST_EXTENSION,"A customer has a past-due personal loan payment that was due on March 10th, and the bank has initiated collections after the payment was missed. The customer explains that they are currently experiencing financial hardship due to a reduction in work hours at their part-time job, which is their primary source of income. They are requesting an extension to move the due date from April 10th to May 15th, as they need more time to stabilize their income and avoid late fees.","

Bot: Hi there, this is an important message from your bank regarding a past-due balance on your personal loan. We wanted to reach out and see how we can assist you in getting back on track.

User: cant rember wut date the payment was due but i think it was like march 10th? i havent been able to pay it yet cuz my work hrs got cut back at my part-time job and i need a little more time

Bot: Thank you for getting back to us. I see that the payment was due on March 10th. We understand that unexpected changes can happen, and we're here to help. Can you tell me a little more about your current financial situation? How long do you think you'll need to get back on track?

User: well i think im gonna be good by may 15th. thats why im hoping i can just have the due date moved to that date so i dont get any late fees

Bot: I understand your concern about the late fees. Let me see what I can do. Can you confirm that you're looking to move the due date from April 10th to May 15th?

User: yeah thats rite. may 15th is when i think i can pay it off no problem

Bot: Okay, I've taken note of your request. I'm going to go ahead and process the extension for you. You should receive an updated statement with the new due date. Is there anything else I can assist you with today?",neutral,typos
REQUEST_EXTENSION,"A customer has a past-due personal loan payment that was due on March 10th, and the bank has initiated collections after the payment was missed. The customer explains that they are currently experiencing financial hardship due to a reduction in work hours at their part-time job, which is their primary source of income. They are requesting an extension to move the due date from April 10th to May 15th, as they need more time to stabilize their income and avoid late fees.","

Bot: Hi there, this is an automated call from [Bank Name]. We're calling about your personal loan account that's past due. Can you please confirm your name so we can better assist you?

User: Yes, my name is John Doe. I'd like to discuss my account with you. I believe the payment due date was March 10th, but I missed it due to unforeseen circumstances.

Bot: I apologize for any inconvenience this has caused, Mr. Doe. Can you please tell me a little bit about what's going on with your account? What's the current balance, and what's the amount you're past due by?

User: The current balance is $1,200, and I'm about $300 past due. However, I'm currently experiencing financial hardship due to a reduction in work hours at my part-time job. This is my primary source of income, and I'm finding it challenging to make ends meet.

Bot: I understand that this can be a difficult situation, Mr. Doe. We want to work with you to find a solution that fits your needs. Can you please tell me more about your work hours and when you expect your income to stabilize?

User: My work hours have been reduced by about 20% over the past few months, and I'm expecting a slight increase in my income once I complete a few projects. However, I need some more time to stabilize my income before I can make the payment. Would it be possible to extend the due date from April 10th to May 15th?

Bot: I can certainly look into that for you, Mr. Doe. Can you confirm that the amount you're past due is $300, and the payment due date you're requesting to extend is May 15th?",neutral,professional
REQUEST_EXTENSION,"A customer has a past-due personal loan payment that was due on March 10th, and the bank has initiated collections after the payment was missed. The customer explains that they are currently experiencing financial hardship due to a reduction in work hours at their part-time job, which is their primary source of income. They are requesting an extension to move the due date from April 10th to May 15th, as they need more time to stabilize their income and avoid late fees.","

Bot: Hi there, this is an important message from our bank regarding your personal loan. We wanted to reach out to you about your recent payment that was due on March 10th.

User: wut? whos dis? why r u txtin me?

Bot: Hi, I apologize if we caught you off guard. This is a friendly reminder from our bank. We're concerned about the late payment on your personal loan. Can you please confirm your account information so we can discuss this further?

User: whos confirmn info?? u got all my info already... i just wanna no whats goin on. i dont wanna pay no fees

Bot: I understand your concern. We're here to help. It seems there was an issue with the payment on your personal loan. Unfortunately, it's now past due. We've received reports that you're experiencing financial difficulties. Can you tell me a bit more about what's going on? Are you facing any financial challenges that might have affected your ability to make the payment on time?

User: yeah... my work hours got cut back... i dont get as much cash as i need... i gotta make it work tho

Bot: I'm so sorry to hear that. We're here to support you. Can you tell me more about your work hours being cut back? Are you looking for other opportunities or ways to increase your income?

User: yeah... i'm lookin into it... but i need some time to get it all sorted out. can i push the due date back to may 15th? i dont wanna get hit with no late fees

Bot: I understand your situation, and I'd be happy to help you. However, let me check with our collections team to see what options are available to you. Can you please give me a moment?",confused,slang
REQUEST_EXTENSION,"A customer has a past-due personal loan payment that was due on March 10th, and the bank has initiated collections after the payment was missed. The customer explains that they are currently experiencing financial hardship due to a reduction in work hours at their part-time job, which is their primary source of income. They are requesting an extension to move the due date from April 10th to May 15th, as they need more time to stabilize their income and avoid late fees.","

Bot: Hello, this is [Bank Name] collections department. We're calling about your past-due personal loan payment. Can you please confirm your account information so we can discuss this further?

User: whr r u callng frm? wot pmt r u tlking abt?

Bot: I'm calling from [Bank Name]. We're discussing your personal loan payment that was due on March 10th. We've received notice that the payment hasn't been made.

User: oh yea... i no i missed tht pmt... i've ben havng some problms wth my job... my hrz r redctd rite nw & i cnt afford 2 pay.

Bot: I understand that unexpected changes in your income can be challenging. Can you tell me a bit more about your current financial situation and how you plan to get back on track with your payments?

User: rilly? u cnt jst w8 til nxt pmt? i no i cnt aford 2 pay by aprl 10th... cn i pls hv till may 15th 2 pay?

Bot: I'd be happy to help you explore options. However, I do need to review our policies and discuss this with my supervisor. Can you confirm that you're requesting a payment extension from April 10th to May 15th?

User: yea... tht's wot i need... plz cn u help me?",confused,typos
REQUEST_EXTENSION,"A customer has a past-due personal loan payment that was due on March 10th, and the bank has initiated collections after the payment was missed. The customer explains that they are currently experiencing financial hardship due to a reduction in work hours at their part-time job, which is their primary source of income. They are requesting an extension to move the due date from April 10th to May 15th, as they need more time to stabilize their income and avoid late fees.","

Bot: Hello, this is [Bank Name] collections. I'm reaching out regarding your personal loan with us. We have a past-due payment that was due on March 10th.

User: Good morning, thank you for contacting me. I'm aware of the overdue payment, and I appreciate your call. Unfortunately, I'm currently experiencing some financial hardship due to reduced work hours at my part-time job.

Bot: I'm sorry to hear that, and I appreciate your honesty. Can you tell me a bit more about your situation and how long you expect these reduced work hours to last?

User: Well, my part-time job is my primary source of income, and the reduction in hours has significantly impacted my ability to meet my financial obligations. I'm hoping to stabilize my income over the next few weeks, and I'm requesting an extension on the due date to avoid late fees.

Bot: I understand your concerns, and I'm happy to help. Can you tell me what specific due date you're requesting, and what date you would like to move the payment to?

User: I would like to request that the due date be moved from April 10th to May 15th. This will give me sufficient time to stabilize my income and ensure I can make the payment without incurring any additional fees.

Bot: I've taken note of your request. I'll need to discuss this with our collections team to see what options we can provide. Can you confirm that you're aware of the interest that has accrued on your account since the past-due payment?

User: Yes, I'm aware of the interest that has accrued. I understand that I'm responsible for paying this amount, and I'm willing to discuss a plan to pay it off.

Bot: Great. I'll get back to you within the next 24-48 hours to let you know our decision regarding the extension. In the meantime, if you have any questions or concerns, please don't hesitate to reach out.

User: Thank you for your time and assistance. I appreciate your help in this matter.",neutral,professional
