intent,scenario,conversation_text,sentiment,user_speech_type
SEND_STATEMENT_COPY,"The bank has reached out to a customer about a past-due auto loan payment. The customer recently experienced a serious family health emergency, which caused them to miss several days of work and temporarily lose access to their primary banking devices. As a result, they were unable to monitor their account or receive payment reminders. Now that they are back on their feet, they want to address the overdue balance but need a copy of their September 2024 auto loan statement to verify the details before making a payment.","

Bot: Hi there, this is [Bank Name] reaching out regarding your auto loan account. We wanted to touch base about the past-due payment. Can you please tell me a little bit about what's been going on?

User: omg, hi! i'm so sorry i've been super behind on my payments. we had a really bad family situation going on and i wasn't really able to keep track of anything. i just got my devices back up and running and i'm trying to get everything sorted out. what's the deal with the overdue payment?

Bot: I'm so sorry to hear that you and your family are going through a tough time. We're here to help you get back on track. Can you tell me a bit more about what you're looking to do next? Are you planning on making a payment today or would you like to discuss some other options?

User: yeah, i want to make a payment, but i need to see my statement first so i can make sure everything is accurate. do you guys have a way for me to get a copy of my september statement? that's the one that's past due

Bot: Absolutely, I can definitely help you with that. We can send you a copy of your September statement via email. Would you like me to go ahead and do that for you?",confused,casual
SEND_STATEMENT_COPY,"The bank has reached out to a customer about a past-due auto loan payment. The customer recently experienced a serious family health emergency, which caused them to miss several days of work and temporarily lose access to their primary banking devices. As a result, they were unable to monitor their account or receive payment reminders. Now that they are back on their feet, they want to address the overdue balance but need a copy of their September 2024 auto loan statement to verify the details before making a payment.","

Bot: Hello, this is [Bank Name] calling about your auto loan account. We wanted to follow up on a past-due payment that's now 30 days overdue. Can you please confirm your name and account information so we can discuss this further?

User: Good morning, thank you for reaching out. My name is [Customer Name], and I believe you're referring to my auto loan account. I'd like to discuss this, but I need some information from you first. Can you provide me with a copy of my September 2024 auto loan statement, please?

Bot: I'm so sorry to hear that you've been dealing with a family health emergency. I'm here to help. I can certainly provide you with a copy of your statement. However, I need to inform you that we're calling about a past-due payment. Can you please confirm that you're aware of the payment due date and the amount that's overdue?

User: Yes, I'm aware of the situation. It's just that I wasn't able to access my account or receive payment reminders due to the emergency, which led to the delay. I'd like to make a payment, but I need to verify the details. Providing me with a copy of the statement will allow me to do that. Can you please expedite the process?

Bot: I understand your situation, and I apologize for any inconvenience this has caused. I can certainly provide you with a copy of your statement. However, I need to let you know that we have a process in place for past-due accounts. If you're unable to make a payment, we can discuss possible options to get your account back on track. But first, I'll send you the statement. Would you prefer to receive it via email or mail?

User: Thank you for your understanding. I'd prefer to receive the statement via email, please. Also, could you please confirm that the statement will contain all the necessary details, including the past-due amount and any fees that may have been incurred?

Bot: I'll make sure that the statement is sent to you via email. It will include all the necessary details, including the past-due amount and any fees that may have been incurred. Please allow a few minutes for the email to arrive in your inbox. Once you've received the statement, we can discuss your options for paying the overdue balance. Would you like to schedule a call to review the statement and discuss your payment options?",neutral,professional
SPEAK_TO_AGENT,"The bank has reached out to a customer about an overdue personal loan. The customer states they have been experiencing technical issues with their online banking account and were unable to make their payment. They want to speak to a person to resolve the issue, make the overdue payment, and ensure their account is up to date.","

Bot: Hello, this is a representative from [Bank Name]. We've sent you a message regarding your personal loan, which is currently past due. How can I assist you today?

User: Thank you for reaching out. I apologize for the delay, but I've been experiencing some technical issues with my online banking account, which prevented me from making the payment on time. I'd like to resolve this matter and get my account up to date as soon as possible.

Bot: I apologize for the inconvenience you've experienced. I'd be happy to help you resolve this issue. Can you tell me a little more about the technical issues you were experiencing? Was there an error message or something that prevented you from accessing your account?

User: Yes, I was receiving an error message stating that my account was temporarily unavailable. I tried to log in multiple times, but I couldn't access my account. I'm not sure if it was a server issue or something on my end.

Bot: I've made a note of that. I'm going to go ahead and assist you in making the overdue payment. Can you please confirm your account information so I can proceed with the payment?

User: Of course, I'd like to confirm my account information with you to ensure everything is accurate. However, I'd also like to request to speak with a supervisor or someone who can review my account and ensure that all the necessary corrections are made to reflect the payment that I will be making today.

Bot: Absolutely, I'd be happy to escalate your issue to a supervisor. They will review your account and ensure that everything is accurate. Let me go ahead and transfer you to them. Please hold for just a moment.",neutral,professional
SPEAK_TO_AGENT,"The bank has reached out to a customer about an overdue personal loan. The customer states they have been experiencing technical issues with their online banking account and were unable to make their payment. They want to speak to a person to resolve the issue, make the overdue payment, and ensure their account is up to date.","

Bot: Hi there, this is [Bank Name] calling about your personal loan account. We've noticed that your payment was due last month and hasn't been made yet. Can you tell me a little bit about what's going on?

User: oh no, hi! yeah, i've been trying to make the payment but i've been having some issues with my online banking thing. it just keeps saying there's a problem and i don't know what to do.

Bot: I'm happy to help you sort that out. Can you tell me more about the issue you're experiencing with your online banking? Was there an error message or anything that happened when you tried to make the payment?

User: um, i don't know... it just says ""technical difficulties"" or something like that. i tried to log in a few times but it won't let me in. i'm really worried about this because i know i need to make the payment or else...

Bot: Don't worry, we're here to help you. It sounds like you might need some assistance with your online banking account. Can you please hold for just a moment while I check on some options for you?

User: yeah, okay. sorry to be such a bother.

Bot: No bother at all! I'm here to help. I'm going to go ahead and send you a secure message with some steps you can take to resolve the issue with your online banking account. In the meantime, would you like to make the overdue payment over the phone with me today?

User: yeah, that would be great! thank you so much for your help.",confused,casual
SPEAK_TO_AGENT,"The bank has reached out to a customer about an overdue personal loan. The customer states they have been experiencing technical issues with their online banking account and were unable to make their payment. They want to speak to a person to resolve the issue, make the overdue payment, and ensure their account is up to date.","

Bot: Hi there, this is [Bank Name] calling about your personal loan account. We wanted to follow up on a payment that's past due.

User: Oh, hi! I'm so sorry, I've been having some issues with the website lately. It's been acting weird and I haven't been able to log in. I thought I made the payment, but I guess it didn't go through.

Bot: I apologize for the inconvenience. Can you please confirm your account information so I can look into this further? This will help me assist you better.

User: Um, it's my name is [name], and I think my account is [account type], but like, I'm really not sure what's going on with this website. It's just been glitching a lot.

Bot: Okay, I've located your account. It seems like there was indeed a technical issue with our online banking system that prevented the payment from going through. I'm happy to help you resolve this and get your account up to date.

User: Oh, okay, that makes sense, I guess. But how do I go about making the overdue payment then? Do I need to come into the bank or something?

Bot: We have a few options available to you. You can make a payment over the phone using a debit or credit card, or we can set up a payment plan that works for you. Which one sounds more convenient to you?

User: Hmm, I think I just want to get it over with, you know? Can I just pay it now?

Bot: Absolutely, I can assist you with that. Can you please provide your payment information, such as your card number and expiration date?",confused,casual
SPEAK_TO_AGENT,"The bank has reached out to a customer about an overdue personal loan. The customer states they have been experiencing technical issues with their online banking account and were unable to make their payment. They want to speak to a person to resolve the issue, make the overdue payment, and ensure their account is up to date.","

Bot: Hi there, this is [Bank Name] calling about your personal loan account. We wanted to follow up on the overdue payment that's currently past due.

User: Are you kidding me? I've been trying to get on my online banking for the past week and I couldn't log in because of some stupid technical issue. Now you're calling me about a payment I never even made?

Bot: I apologize for the inconvenience you've experienced with your online banking. Can you tell me a little bit more about what happened with the technical issue? We'd like to help you get back on track.

User: Look, I don't care about the technical issue right now. I just want to make the payment and be done with this. Can I please talk to a real person?

Bot: I understand your frustration, and I'm happy to help you resolve this issue. I can certainly assist you in making the overdue payment today. Before we get started, may I just confirm your account information to ensure we're talking about the correct account?

User: Just hurry up and help me, okay? And can you make sure my account is up to date so I don't get any more calls like this?

Bot: I'll take care of getting your account updated and making the overdue payment today. To confirm, I just need to verify a few details with you. Can you please confirm your name and the last four digits of your social security number?",angry,casual
SPEAK_TO_AGENT,"The bank has reached out to a customer about an overdue personal loan. The customer states they have been experiencing technical issues with their online banking account and were unable to make their payment. They want to speak to a person to resolve the issue, make the overdue payment, and ensure their account is up to date.","

Bot: Hi there, this is [Bank Name] calling about your account. We wanted to reach out to you regarding a past-due balance on your personal loan. Can you please tell me a little bit about what's going on?

User: Hey, yeah, I've been having some issues with my online banking account lately. I wasn't able to log in and make my payment, so I'm guessing that's what's causing the problem.

Bot: I apologize for the inconvenience you've experienced. Can you please confirm your account information so I can look into this further for you?

User: Yeah, my account is in my name, and I've had the loan for a few years now. I'm pretty sure everything is up to date, but I haven't been able to get into my account online for a few weeks.

Bot: Okay, I've located your account. It appears that there was an issue with your online banking session that prevented you from making the payment. However, we do have a past-due balance that needs to be addressed. Would you like to discuss possible options for getting your account up to date?

User: Yeah, I'd like to make the overdue payment and get everything sorted out. Can you tell me what my options are?

Bot: We can discuss a few different options for getting your account current. Would you like to pay the past-due balance in full, or would you prefer to set up a payment plan to spread the cost over a few months?",neutral,casual
CREDIT_SCORE_QUERY,"The bank has contacted a customer about a past-due student loan balance that is now 120 days overdue. The customer, a recent college graduate who is struggling to find a job in their field, is concerned about how this delinquency could affect their credit score, especially since they're relying on their credit to qualify for a low-interest personal loan to help pay off student debt. They are seeking information on whether the current delinquency has already been reported to the credit bureaus and what impact it could have on their credit score.","

Bot: Hi there, this is [Bank Name] reaching out about your account. We wanted to follow up on your student loan balance that's past due.

User: wht happend to my account i havent made a payment in a wile

Bot: We understand that life can be unpredictable, and we're here to help. You're right, we haven't received a payment from you in a while. Our records show that your account is 120 days past due.

User: ok, i just got out of college and havent been able to find a job in my field yet. im trying to get a personal loan to help pay off this debt

Bot: I completely understand, and we're happy to work with you. However, I want to make sure you're aware of the potential impact on your credit score. Have you had a chance to review your account status and consider making a payment to bring it current?

User: yea, i was wondering if this delinquency has already been reported to the credit bureaus? and if so, what kind of effect will it have on my credit score?

Bot: I can provide you with information on our reporting policies. We typically report past-due accounts to the credit bureaus 90 days after the due date. Since your account is 120 days past due, it's likely that the information has been reported already. The impact on your credit score will depend on various factors, including your overall credit history and the severity of the delinquency. I recommend checking your credit reports from the three major credit bureaus to get a more accurate picture of your credit score.

User: ok, thank you for the info. do you have any suggestions on how i can get back on track with payments?

Bot: We're here to help. Considering your situation, I can offer you some options to get back on track. We have a payment plan program that can help you make manageable payments towards your balance. Additionally, you may want to consider making a payment as soon as possible to avoid any further reporting to the credit bureaus. I can provide you with more information on these options if you're interested.",neutral,typos
CREDIT_SCORE_QUERY,"The bank has contacted a customer about a past-due student loan balance that is now 120 days overdue. The customer, a recent college graduate who is struggling to find a job in their field, is concerned about how this delinquency could affect their credit score, especially since they're relying on their credit to qualify for a low-interest personal loan to help pay off student debt. They are seeking information on whether the current delinquency has already been reported to the credit bureaus and what impact it could have on their credit score.","

Bot: Hi there, this is [Bank Name] reaching out about a past-due balance on your student loan account. We wanted to check in and see how we can help you get back on track.

User: Hey, yeah I knew that was past due. I've been trying to find a job in my field, but it's tough right now. I'm worried about how this delinquency might affect my credit score.

Bot: I completely understand your concern. We want to help you understand how this might impact your credit score. The delinquency has been reported to the credit bureaus, but it's still within the 120-day mark, so it hasn't yet reached the point of being severely delinquent.

User: Okay, that helps to know. But how bad could it be? Will it be a big hit on my credit score?

Bot: The impact on your credit score will depend on several factors, including your credit history before this delinquency and how you manage your payments going forward. Generally, a single delinquency of this length can lower your credit score by 50-100 points, but it's not a guarantee.

User: Okay, I see. And what if I'm trying to get a personal loan to help pay off my student debt? How might this delinquency affect my chances?

Bot: If you're applying for a personal loan, the lender will likely review your credit report as part of the application process. While this delinquency can make it harder to qualify for a loan, it's not a deal-breaker. You may still be able to qualify for a loan, but the interest rate or terms might be less favorable.

User: Alright, I think I understand. What can I do to get back on track and minimize the impact on my credit score?

Bot: We'd be happy to work with you to set up a payment plan that fits your budget. We can also discuss options for temporarily reducing or suspending payments if you're facing financial hardship. Let's schedule a call to go over the details and find a solution that works for you.",neutral,casual
CREDIT_SCORE_QUERY,"The bank has contacted a customer about a past-due student loan balance that is now 120 days overdue. The customer, a recent college graduate who is struggling to find a job in their field, is concerned about how this delinquency could affect their credit score, especially since they're relying on their credit to qualify for a low-interest personal loan to help pay off student debt. They are seeking information on whether the current delinquency has already been reported to the credit bureaus and what impact it could have on their credit score.","

Bot: Hi there, this is [Bank Name] reaching out about your past-due student loan balance. We understand that this may be a challenging time for you, and we're here to help.

User: Thank you for contacting me. I appreciate your understanding. I'm concerned about the potential impact on my credit score. Have you reported this delinquency to the credit bureaus yet?

Bot: I completely understand your concern, and I'm happy to provide you with information. As a courtesy to our customers, we typically wait until accounts are 180 days past due before reporting them to the credit bureaus. However, in your case, we've been working with you to find a solution, and we want to keep you informed about the status of your account.

User: That's helpful to know. But even if you haven't reported it yet, I'm worried about the potential damage to my credit score. Can you tell me what I can expect if it does get reported?

Bot: We understand your concern, and I want to assure you that our goal is to help you get back on track. If we do report the delinquency, it may temporarily affect your credit score. However, it's worth noting that credit scores are based on a variety of factors, and this one instance may not have a significant impact on your overall credit history.

User: I appreciate your explanation. Can you tell me more about what factors contribute to my credit score, and how this delinquency could fit into the bigger picture?

Bot: Certainly. Your credit score is calculated based on several factors, including payment history, credit utilization, credit age, and credit mix. While this delinquency is a concern, it's just one factor among many. We're happy to work with you to find a solution that gets your account back on track and minimizes the impact on your credit score.

User: That sounds reassuring. What options do I have to resolve this delinquency and prevent further damage to my credit score?

Bot: We have a few options available to you, including a payment plan that can help you get caught up on your payments and avoid any further negative marks on your credit report. We can also discuss other alternatives that may be more suitable for your situation. Would you like to explore these options further?",neutral,professional
CREDIT_SCORE_QUERY,"The bank has contacted a customer about a past-due student loan balance that is now 120 days overdue. The customer, a recent college graduate who is struggling to find a job in their field, is concerned about how this delinquency could affect their credit score, especially since they're relying on their credit to qualify for a low-interest personal loan to help pay off student debt. They are seeking information on whether the current delinquency has already been reported to the credit bureaus and what impact it could have on their credit score.","

Bot: Hi there, this is an automated message from your bank. We wanted to reach out to you regarding your past-due student loan balance. Can you please let us know how you'd like to proceed with this matter?

User: hi whats going on with my accnt i havnt heard from yous guys in a while

Bot: We apologize for any confusion. We're reaching out because your account is currently 120 days past due. We're here to help you find a solution and get back on track. Can you please confirm your account information so we can better assist you?

User: ok thats fine i guess i just wanna know if this is gonna hurt my credt score or ennything

Bot: We understand your concern about your credit score. We want to assure you that we're committed to transparency and working with you to resolve this situation. As for reporting to credit bureaus, we typically report delinquencies to the credit bureaus after 90 days of non-payment. However, since your account is already 120 days past due, it's possible that the information may have been reported to the credit bureaus. Can you please confirm if you'd like us to look into this further for you?

User: thats whats i was wondring bout i dont wanna get hurt by dis

Bot: We're here to help you understand the situation and find a solution. We can certainly look into this further for you. I'd like to offer you a summary of our next steps. We can review your account and check if the delinquency has been reported to the credit bureaus. We'll also discuss possible options for getting your account back on track and minimizing any potential impact on your credit score. Would you like to proceed with this?",neutral,typos
CREDIT_SCORE_QUERY,"The bank has contacted a customer about a past-due student loan balance that is now 120 days overdue. The customer, a recent college graduate who is struggling to find a job in their field, is concerned about how this delinquency could affect their credit score, especially since they're relying on their credit to qualify for a low-interest personal loan to help pay off student debt. They are seeking information on whether the current delinquency has already been reported to the credit bureaus and what impact it could have on their credit score.","

Bot: Hello, this is a representative from [Bank Name]. How are you today?

User: hey im doin ok i guess. i got ur msg about my student loan bein past due

Bot: Hi, thank you for reaching out. I'm here to help. Can you please confirm your account information so I can better assist you?

User: my account info is all good i think. i just wanna know if u guys have reported my delinquency to the credit bureaus yet?

Bot: I understand your concern, and I'd be happy to provide you with some information. We typically report delinquencies to the credit bureaus after 90 days of non-payment. Since your account is 120 days past due, it's likely that the information has already been reported.

User: ok thats good to know. but what about the impact on my credit score? is it gonna be like a huge hit or what?

Bot: Unfortunately, a delinquency of this length can have a significant impact on your credit score. However, it's worth noting that we're working with you to resolve the issue, and we'll do our best to minimize the damage. Can I explain more about our credit reporting policies and how they might affect your credit score?

User: yeah thats cool. i just wanna know what im dealin with so i can plan accordingly.",neutral,typos
